115	0.03019	face faces fusiform familiar identity ffa recognition unfamiliar perception gyrus fg selective facial famous familiarity occipital person images ofa visual image presented trustworthiness houses matching sensitive personally individual responsive core scrambled people house viewed selectivity identification viewing lateral ventral recognize network identities objects representation upright inversion object larger viewpoint social discrimination previous photographs inverted varied expression detection cars half specialized normal places eyes recognizing holistic morphed configural mouth prosopagnosia functionally view perceptual important localizer categories appearance morphs featural occipito preferential individuation trustworthy passively representations pairs place viewpoints explore dps dp resemblance shows untrustworthy morph respond fie kin encounter nonface expertise 
116	0.02247	task matching strategy strategies versus visuospatial presented judgements prior pattern judgment line involving type included automatic showing format vpc match judged multiple relied explicit led primarily mirrored attribute make require identical ran big structured screen past length hypotheses query misleading instructions major alternate oriented reported rfc abstraction similarities collection relevant superiority rely precursor verbally routes judgement diverge rc mark start hierarchies intuitive convergent continued captured engaging solve relating tended conceptually bpa indistinct clarifying generalisation shares percentile successfully recapitulation extracting broken succeed insensitivity distances formats eliciting reversed decided requirements involvement reflectiveness canonically graceful extrapolation steered unstable contradiction lessen tunnel physiologically verifying 
117	0.03314	object objects visual lateral occipital recognition grasping sulcus loc haptic grasp ventral perception intraparietal cortex size shape manipulation images viewing visually occipitotemporal matching drawings anterior representations naming fusiform familiar presented manipulable properties aips perceptual drawing intact requires views exploration hemisphere pictures relevant image viewed aip lo real form sensitive selective line hand guided overlap observers grasped scene presentation reaching unfamiliar occipito haptically passively interact shown structure scrambled view occurred produced visuo preference small responsive recognize processed parts held otc world unseen touch vision neuropsychological visuohaptic prehensile named guiding binding inanimate simultaneously computations encountered hidden refer orientation lotv neurologically immediately man 
118	0.00929	goal goals planning environmental twins pairs genetic twin london tower concordant mimicry plan tol habit discordant habitual oriented dz hm monozygotic heritability paths guided mz progress influenced ocs unrecognizable recognizable path habits flexibly shift hcp dizygotic overarching directedness chart genetically heavier maintenance moves destructive mimetic lfp desires accomplish implementation pursuit turns devaluation desired start hiragana iconic steps moderately quantify resources pipl bvs land repression assignment member attributable make parks motoricity wang donations adjuvant avpfc wit plos attain intrapair biol desirable threatened environmentally acquainted psychiatry conflicting prepared include maxt surveys advisor prudent internalization gs leaner sonification records neuropsychopharmacology admixture lateralizations encouraged 
119	0.02502	dlpfc prefrontal cortex dorsolateral vlpfc ventrolateral cognitive pfc increases mid required suggested control relevant reflect mediated unclear vis dmpfc regard circumstances indexed remain bilaterally growing cardinal fewer reversed problems gwi neuromodulation dlfpc hallmark poles plays reorder exceptional supportive strategically imbalance dsst habitual measures manipulation rigorous heretofore dlpfcs unlinked completing encourage rooms connecting attained illnesses evinced intensity spdcm misdiagnoses bfq unaddressed landing circumstance carring mppc orbit disruptive mes replaced purposely disproportionate silence recognize anomalous dropped subprocesses performances nonspatial significate stocco mfrt improvisations frdm swbs individualistically fxpc parcellates equity convince leroy engenders wood outperforming xii xi cwt patietal milkwort praised queries conferring 
120	0.01932	hand movements limb motor cortex movement arm foot upper premotor reaching representation effector hands contralateral sensorimotor body ipsilateral reach representations phantom limbs dominant dorsal effectors lower ankle somatotopic executed parts kinesthetic execution handed posture position crossed location postures sulcus actions proprioceptive organization leg amputees grip intraparietal amputation moving ip uncrossed plp studied somatotopy projections magnetic feet grasping fingers transport knee visuo flexion moved extremity configuration mouth lip somatic arms postural extremities wrist palm muscle missing bilaterally somatotopical elbow intact reaches tendon joints parieto reached joint overlapped vibrated prosthetic induce selected stump extensor illusion ipsi shifted neurophysiological pf blindfolded modification toes 
121	0.00704	tool tools knowledge exercise representations abstraction action apraxia familiar manipulation physical pantomimes aerobic motor pantomime actions representation graspable hss unfamiliar intensity bout apraxic pantomiming mechanical praxis lss viewed versus hands manner skilled learned stored ideomotor cycling sensorimotor rest elongation recursive gestures demonstration yielded labeled target toolness ima imaginary buildings pantomimed handles ventro kinematic storing pair lateralized animals encoders mindset sit skillful elongated concretization ir mto ae stretching recursion pliers interventional mindsets prescribed denoting recruiting purposes manipulate led semantics regard peak cortically volunteers mergence toning screwdriver uncommon apple buxbaum eds fourfold affordances lst pieces devoted stationary handle storage requires stubby irs 
122	0.14903	magnetic order resonance neuronal level structures higher suggest patterns correlates involvement increases specifically high addition shown contrast result versus number network normal aim cerebral studied levels identify increasing explore test strongly involving respect impact intensity induce purpose scanned responsible supports modified performing occur type types scanner terms reveal reflects means possibly occurring main association lead notion set time propose occurrence requires characterized predominantly marked characteristic evident evaluated reverse evaluate version mechanism sequences subject pronounced restricted hand functionally obtained characteristics required led detected form global investigation serve reveals generally arising investigates subsequently testing specificity received contrasting taking random includes original origin 
123	0.01541	junction tpj temporoparietal parietal temporo sulcus posterior network temporal rtpj intraparietal ifj precuneus reorienting parieto ips detection insula junctions sharing segments dorsal bilaterally toj praise reversed manipulating abrupt onsets offsets stereotypic makes ifef ltpj vignette poles responder possessing lcr hcr cueing pto photographs undertook graded wolf tpo blame frith reorient entity illustrated avoid fourth combinability pos saxe converse hemispherical implicate vfc auction factive republican corbetta posner kanwisher ambivalent te assesses counts highlighted repeating happier teammates midthickness latips genocide democrat amodio mbr redirection tpjs incest teleological fbs breach jb preformed witnessing occipitotemporoparietal retrosplenium macrostructural ritzl favored conceptualized vogt elaborately infrequency tension 
124	0.0231	post pre roi rois scan hoc dm session sessions scanning scans dn test percent ins evaluate primary pacg evaluated repeated participated main min peri marker minimum investigation sr subject pne psc sg cycles immediately newly involve candidates variance predefined covering priori selected abnormally diabetes hour maxima triggers npc aforementioned hours anova centers purpose localized ompfc operative interests undergo expose euclidean imbalance ratios monitor pebas mellitus emergency tail vbr intense neurovascular radiotherapy fmd persistent offline ed photographs probes investigating endothelial disc binary brachial relaxometry department mechanistic er witness mr secondary enuresis rescan administrated johnson cup nocturnal failures swa refreshment soas alleviate 
125	0.00613	expertise experts ic novices athletes expert conversion religious sport paralysis players anticipation novice sports professional aon skilled scrabble lkm prayer hockey feigning concussed experience skills tea gymnasts tennis feigned ppr believers answering wine years chess predict vsp iaa elite concussion archery golfers compassion god belief soccer dates athlete practice nfvppa fam shooting player board table paresis leading lovastatin basketball christian extraordinary focused randomly wcgs religiosity archers opponents incorrectly leader chinese playing cinematographers mln wcg toolmaking nonreligious religion sporting secular christians practices kindness master mouse performers shot reorganization competitive hypercapnic sdt volleyball supernatural buddhists handicap praying catholics nigan care ball mmms 
126	0.01142	anxiety aggression anxious trait amygdala cr disorder gad anticipation emotional anticipatory high aggressive ha social worry fear temperament individuals panic scores anger threat symptoms phobia reactivity dental relationship limbic iu provocation reactive generalized characterized subclinical bi regulation insula somatic paradigm bpi uncertainty shyness hyper link frustration inhibited state highly opponent distress symptom female agoraphobia altitude retaliation anticipated anticipating psychopathology neurobiological pregabalin maladaptive traits inducing complaints temperamental relate cued ama worrying ap psychiatric selected men male suffering icbt cyclothymic fearfulness blocking apprehension vulnerability relates tap strong preliminary sixteen chemosignals lsas amp taylor pswq provoking medicine anx intolerance hypersensitivity mediation aversion chronic 
127	0.12458	task performance cognitive difficulty performing resonance magnetic accuracy control demands perform level difficult discrimination induced shown levels test patterns correlates demanding improved simple magnitude modulation demand impaired requiring hypothesized reflect version rest provide relationship studied individuals time compensatory scanned scanning generally modified independently monitoring multiple poorer line hard successful context suggesting worse resources engagement fourteen goal reveal improve requires led modulations neurocognitive speed performances simultaneously regional robust easier prominent interfere thirty functions periods varied fixation similarly prone inefficient undergoing widely widespread carry versions engage requirements monitor impair interleaved load predictor parametrically resource ongoing resulted tasking routinely improvement improves intermittent decrement 
128	0.0285	prediction error outcome errors predictive probability expectation predictions outcomes events expectations uncertainty predictability unexpected predicted predict model environment unpredictable models predictable expectancy entropy reflected future cancer chemotherapy predicting likelihood adjustment probabilities pe updating prior coding adaptation upcoming omission theories environmental pes provide context bc internal adjust regularity surprise uncertain expectancies input sensitive violations correct suggested breast adjustments requires preceding importantly violated regularities discrepancy update signaling actions values surprising versus rpe survivors generate magnitude violation optimize adapt adjusting contingencies tracking computations adaptively occurrence beliefs evaluating probable omitted omissions surprisal updates unpredicted wagner contingency unlike probabilistic breaches agents commission unpredictability scaled statement 
129	0.07067	gyrus temporal middle frontal fusiform inferior occipital precuneus superior gyri cingulate parahippocampal posterior magnetic lingual cerebellum parietal resonance lobe cuneus anterior suggest hippocampus thalamus addition bilaterally visual precentral included cerebral angular postcentral hemisphere calcarine supramarginal group association identify phg lower sites parahippocampus lobule lobules detect automatic fourteen impaired possibly students divided lobes adult poles supra college cerebellar persistent pole analyze taking include portions controlled obtained noted pocg tested culmen photograph confronted mapped resulting fissure added presented hypothesised concluded database contributed weakened alternated npsle strabismus marginal vermis heschl imply exotropia exponential helpful centred gyral ling videogame manifests inform exception amygdalae pathogenic 
130	0.01237	risk high taking risky task individuals uhr fp hr seeking suggest history safe sensation risks familial genetic family vulnerability versus averse balloon attitudes correlates bart reported offspring sensitivity seekers cautious neurobiological gain rdlpfc avoidance ultra gamble fhr marker identification presence outcomes penalty neurocognitive stakes relatives likelihood imbalance prospective analogue pass performing investigation purchase analog ill families attitude manifest urgent wave prereading winnings impulsiveness propensity averters cents sdp hrd nat completion conferred sentence poker takers rpi riskier asset obligation nrt guaranteed blunted morbidity simulated chance ripl fpl pumps accrual sis chicken rvlpfc hypoactivation tend punished prominently coping prospects public cent reasons 
131	0.01438	test performance intelligence scores tests memory span verbal neuropsychological digit group speed iq art tmt hp backward relationship forward lower recall scale association esthetic learning battery measures making wechsler symbol iii worse fluid trail artistic standard lobes attention evaluated working auditory positive sdmt cdt vocabulary score testing evaluation lv academic fluency previous jme cn subtest relationships wais subtests elderly revised delayed standardized tablet dst wisc skills paper modalities rey quotient demented adult ravlt capacities intellectual psychometric version performances ranging executive batteries crystallized nondemented drawing word vsc rst scoring distinctive pt figure oral organisation achievement number hba corsi decliners california demographics 
132	0.01308	mtl temporal medial lobe memory hippocampus cortex perirhinal parahippocampal structures associations hippocampal prc phc scenes names associative entorhinal involvement declarative ca subsystem suggest lobes subregions episodic scene binding showing importance roles retrosplenial rhinal unique anteromedial neocortical preferential amnesia subiculum longitudinal fundamental subfields ac pole picture function atn dentate predominant discontinuous amnesic associate volumetric relational play divided statistics unitized oddity diencephalic binds recombined substructures miller configural attached paralimbic correct operation undergone association atr ammonis cornu discontiguous subregional status substrates preexposed timescales nonexposed retrievals ppl yonelinas eichenbaum mtr emphasizing itl spiking interrupt curves morphing complicated demyelination baso ffmi subicular remembrance ctrl chances 
133	0.01258	pd error errors disease parkinson monitoring medication levodopa performance mfc correct tremor motor pmfc dopamine dopaminergic ern dopa racc detection rostral normal rates impairments adjustments erroneous naive deficit bg commission common fog compensatory putamen drug replacement severity controlled characterized prefrontal panic age updrs rigidity novo output committed improvement parkinsonian subthalamic depletion prior negativity mistakes slowing unexpectedness idiopathic disorder resulting moderate proposed profile pdd demented incorrect status failure drooling pdtp antisaccade nigrostriatal unified perseverative fewer yahr hoehn occurring iii icds pdwithvhs rcz deficiency ne akinesia rigid rate optimization hta eoc withdrawal seventeen occurrence accuracy subgroup classical ndpd oedema cardinal syn therapy 
134	0.07887	motor cortex supplementary sma premotor primary sensorimotor sensory pre network control somatosensory cerebellum task hand movement planning dorsal cerebral execution passive pattern putamen visuomotor pmd output studied play action bilaterally movements simple voluntary important visually involving central secondary cerebellar hemisphere lateral guided precentral manual generation feedback presence measure thalamus cued input monitoring handed unclear identified ventral participate preparation addition presupplementary purpose proper commands cma orofacial volitional controlled induces ipsilateral sites skills concept involves neurons objective served remained programs pure sixteen wide reflect copy progressive separated partly pma possibly represents executing participates acts ii programming initiation repeated sensori degenerative maintaining contralateral 
135	0.02005	basal ganglia moral guilt harm judgments judgment thalamus forebrain care transgressions scenarios violations gratitude actions lying harmful morally justice personal wrong dilemmas acts judged cost sentiments cholinergic benefit bad morality norms issues conventional good utilitarian anti accidental unified legal shame lives violation serves judge evaluating purity harms transgression evaluations bgn guilty meynert dilemma causing benefactor cheese dishonest perpetrator competitors acting ventromedial rule welfare save pgacc basalis purely rating acceptable neurogenic deontological indignation immoral victims phd scenario str regulating keeping rules kinds deed cleansing honesty lenient sentiment impure harming septum forgivability antecedents gate principles imminent cope ethics neurones beneficiary wdp wrongness 
136	0.01708	white matter tensor structural integrity fractional tracts corpus callosum tract fasciculus pathways diffusivity tractography longitudinal values cc weighted microstructural md superior measures structure connecting microstructure voxel capsule cingulum arcuate spatial lower internal fibers statistics association abnormalities corticospinal pathway shown interhemispheric callosal uncinate probabilistic af myelination tbss slf multimodal fronto water dt major radiation splenium widespread fascicle properties abnormal increases cst genu gray tracking indices transfer radial structures thalamic index adc bundle axon radiata axonal optic communication cross projections fornix corona dwi peduncle bundles connect limb maps speed specifically pyramidal conduction fibre myelin fasciculi architecture burden fibres ii ppms diameter coefficient 
137	0.01926	regulation emotion reappraisal negative cognitive amygdala emotional emotions nf strategies regulate prefrontal control neurofeedback suppression affect regulatory strategy rtfmri regulating individuals instructed underlying viewing reported real successful images coping modulate downregulation ratings success mindfulness distraction aversive acceptance reduce modulation voluntary sad pictures effortful report expressive passive regulated upregulation generation thought functioning maintain reappraise experience repressors sacc suppressing suppress arousing successfully volitional voluntarily affective reappraising impaired resulted feelings reduction distress subjective naturally habitual attenuate notably instructions correlates maladaptive interventions situation thirty react passively reducing neurophysiological capacity craved downregulate uncontrollable inversely sham engage undergoing sensitizers volitionally distancing emotionally typical instruction reactions arousal 
138	0.01502	real virtual reality world monitoring environment device products generated online scanner source paradigm product open rp room live distortion paradigms unit time vr communication compatibility updating passive incremental simulate decade pressure relevant leading events instructed units incompatible visible leads simple approaching platform inside steering simulated realistic mr motivations cmi consumers scenario navigation series sources correlates sgica rival bore depicted controlled market marketing rf technology situation interacts camera hidden tested recruit adhesion unreal deliver qualitative laboratory breaks water dictionary dodges facebook obstacles branching morris neurofeedback pursued decoupling apparatus safe exploring workload capable devices dangerous delivery screen variables vhi immersive director sensing 
139	0.03295	faces emotional facial expressions emotion amygdala neutral fearful happy face sad emotions angry expression social fear response perception affective recognition anger affect disgust viewing happiness gender sadness magnetic fusiform presented resonance interaction emotionally salient expressing masked threat limbic viewed sensitivity suggest versus labeling implicit rated static volunteers expressive methods presentations communication intensities authenticity disgusted focused valence perceiving threatening displaying scanning contempt socially intense genuine smiling incidental scrambled surprised presentation amygdalae recognize biases biologically socio judgments authentic communicate matching responsivity express conveying convey pictures posed morphed mood material nonconscious procedure joy morphs surprise depicted signaling decoding recognizing ekman circuitries judging sec 
140	0.00684	epilepsy temporal lobe mtle tle seizure interictal epileptic seizures mesial surgery discharges bladder onset sclerosis ictal focal hs patient contralateral simultaneous spikes generalized resection ipsilateral preoperative postoperative epileptiform reorganization epileptogenic function unilateral ige hippocampal methods gtcs impaired refractory ieds propagation surgical abnormalities spike intractable wave bects recordings ez focus fs partial intracranial included significance idiopathic consciousness presurgical outcome extratemporal cae evaluation gswd hyperthermia epilepsies filling pathological sided preoperatively postoperatively mts incontinence free zone drug medically studied discharge predictors po frequent impairments months dfc atlr concordant ltle predictive pnes dv contamination electrodes myoclonic clonic resections myoclonus pathologic tonic video iii childhood 
141	0.1262	systems predicted models theory suggest human strength process theories tested provide view thought test linked function strong specifically mechanisms representations supporting multiple context hypothesized supported proposed suggesting independent work subsequent predict cognition individual contrast humans recently predictive predicts sensory predictions representation strongly line interact relationship provided mediated ventral cortex selectively states functions interactions weak functionally idea hypotheses roles act reflects propose internal reflecting engage theoretical underlying simple mediate represent involving largely linking shown links framework modulate underlie unknown procedure implications forms proposes input relies serve guide shared signatures phenomena separable leading implemented past posit shaped rapid form tracking manner relationships 
142	0.01413	scene scenes perspective navigation person ppa route egocentric place parahippocampal allocentric taking retrosplenial environment virtual hippocampus rsc natural spatial perspectives cortex representations view hippocampal visual landmarks navigational orientation required maze direction landmark representation viewpoint st survey knowledge images world places strategies navigate views flexible familiar routes environmental facing mazes map scanning opa refresh naturalistic half pointing image precuneus indoor learned buildings slanted room navigating detected path encoded outdoor large triplets underpinnings target locations city recalling fs layout selective stored distinguishes adopting spontaneously navigators viewpoints hallways navigationally relies latency reality disorientation avatar filmed situation town remote geometric heading skill physical importance 
143	0.03105	action actions observation premotor hand goal execution observing parietal actor simulation planning movements suggest representations aon goals performing human body plans dance ventral sensorimotor observer videos abstract observers intention grasping ball embodied intentions intended properties intransitive selection intentional view agent kinematics internal network object executing planned executed act pmv preparation coding representation dancers addition actors understand manipulation means sequences classes theories engaged transitive prediction static transformation modulates acting person pantomimed freely execute referring place plan flexible watched triggered acts trigger perform hmns movies effector putative possibly steps intentionally occipitotemporal visuomotor sector watching outcome manual triggers viewed outcomes repertoire anticipate projecting 
