0	0.02013	symptoms severity symptom hallucinations disorder scores vwm scale neuropsychiatric negative psychiatric avh apathy severe scz abnormalities psychotic limbic delusions signs disease sample positive association pathophysiology abnormal patient expression verbal relationship presence insula characterized methods neurological pathological central psychopathology treatment correlates psychosis development result impaired hyperactivation hallucination illness subscale subgroups pathophysiological free frequently delusional spectrum frequent syndrome ah prognosis syndromes questionnaire neurobiological subgroup subclinical acute symptomatic evident heterogeneous inventory shown insomnia unawareness passivity episodes tested underlie ces somatization sle disabling disinhibition morbidity remission rating identify associations subscales persecutory diagnoses population medication injury delusion hallucinatory dimensions pathology gts aberrations prevalent asymptomatic dysregulated 
1	0.02536	treatment therapy baseline weeks intervention treated improvement cognitive pi cbt group magnetic responders week resonance pre response post treatments interventions outcome trial received scanned reduction therapeutic scans randomized lower methods prior months antidepressant scan follow improved future sessions disorder psychotherapy ect outcomes receive positive symptoms improve drug rating participated olanzapine female induced cet aim scanning strategies successful scale pretreatment markers risperidone prevention improvements symptom controlled neurobiological antipsychotics targets untreated promising patient randomly pharmacological targeted medication receiving remained included vm resistant parameters cbtp treating objectives list predictive reductions needed suffering visit usual preliminary fronto moderate thirty health pilot predictor responsiveness normalized 
2	0.01162	problem problems arithmetic solving calculation mental mathematical math ag addition angular multiplication parietal subtraction operations retrieval operation number solution gyrus ef solved sulcus numerical insight solutions intraparietal competence solve single strategies adults cognitive cognition mathematics arithmetical small simple digit size equations strategy verbal abacus computation difficulty skills mo facts solvers supramarginal procedural grade equation division representation operand reasoning exception constraint lesion hips regular symbolic reliance approximate calculations numeral operators educational abstract manipulation rely nl graders breaking multiplications gifted competency symbols digits difficult transformations subtractions scholastic restructuring pspl aha competent relaxation operands school students interpretation surface mastery lg mathematically answer algebra 
3	0.023	task switching set rule switch rules flexibility cognitive lpfc shifting response control sets lateral costs shift trial sorting card demands parietal paradigm required wcst trials flexible repeat cost frontoparietal shown switches wisconsin executive goal test implementation maintenance stability execution shifts flexibly switched bottleneck paradigms selection preparation mechanisms abstract effortful reconfiguration update requiring performing cue stay moment frontostriatal multitasking select matching protocol transient rapidly inertia dimensions isolate measure goals mappings color functions humans mapping adapt governed alternate cards relying relevant executed cued simple implement repeating desired pragmatic thoughts arbitrary bottlenecks bivalent perseverative overt irrelevant relies shape residual updated ignore circumstances configuration 
4	0.01561	cerebellar cerebellum lobule vi ii motor lobules dentate vermis ataxia iv cerebral nuclei iii sca posterior functions viii involvement hemispheres bilaterally spinocerebellar cerebro recently sites viib eyeblink vii human corrected prominent ix viiia nucleus mot degeneration mr cerebrum parts aim loop type hemispheric hofc loops vermal nonmotor pontine predominantly viia posterolateral erho engaged frailty cerebello paravermal friedreich portions bafme ebc pathology cerebrocerebellar summarize interposed pica hemispheral originating neocortical feed normalization hvi airpuff viiib neocerebellum clues ultra occurs infratentorial neocortex epm ataxias ponto tonsil climbing adequate sides young modules classical frontocerebellar bgtm skilled semilunar synaptic quadrangular lobuli neuropathological durations vestibular confirms 
5	0.01108	body bodies eba parts perception bodily extrastriate sense ownership image agency lotc human images representation feeling photographs fba shape distorted rubber schema occipitotemporal person somatosensory viewed participant experience actions multisensory size appearance xenomelia character rhi posture consciousness insula visuotactile dissatisfaction main pha real somatic votc postures representing fusiform artificial located involvement ego sum persons perceived owned description underpinning attribution localizer mismatch periphery biid incorporation laws photograph watched felt mounted occluded setup visible perceive sensations gd sexualized bsd fake invisible preferred receives oneself torso notably distortions producing handle striate cameras adaption flowers corporeal amputated dorsoventral interior synchronously prefer needle desire prerequisite 
6	0.00902	implicit explicit cd task awareness implicitly automatic answers artificial fd conscious iat intuition attitudes indirect relationships intuitive sica fb answer statements hcs involve appropriateness augmented indirectly pssi hct deliberation test esl facilitation schematic nonconscious fpe deliberate isl material nfb hipp vse fallacy utilized manipulate laterality random reflecting nondiagnostic clarification illegal unconscious indoors crohn femop siat pss irrelevance outdoors gap hemodynamic tentatively systemizers contextualization parahipp maxim extrapolated spf intuitively dyspepsia correctness alphabeticality professions science pairings attitude outgoing voi pho moderately knew adultery pik lpg april leas misconceptions hormob notwithstanding conversations rnd thermoreception unveiled pharmaceutical nonmanual blamed plural inflict evaluates prejudiced builds 
7	0.03714	single trial task multiple level simultaneous subject run time independent simultaneously identified patterns runs temporal detected amplitude conventional spatially temporally approach presented target yielded informed regional sites fluctuations auditory detect oddball multi number sequential regressor amplitudes type series isolated subsequent maps detection recorded epoch epochs limited technique successfully shows processed captured traditional wise variance means count optimized separate timing separately resolution suited progressively order regressors recordings combine generate measurement viable informative latency validation removed utilized spatio pattern yield improving numbers extracting interface calculating sessions itc accomplished detecting cascade local pair pick generalizability built quality hard refining rte evolve volunteer divide 
8	0.03037	cues cue target orienting cued preparation attention trials preparatory cueing targets endogenous invalid attentional spatial anticipatory alerting exogenous task valid expectancy subsequent upcoming location neutral validity presented time reorienting arrow preceded visual predictive frontoparietal indicating ant warning test correlates presentation increases prepare detection manipulated separate uncued modulate times anticipated expectations spatially period informative induced triggered provided ior biases expectation likelihood issue predicted invalidly visuospatial reaction execution informed performing color preceding uncertain contingent events retro preparing soa validly guided paradigms peripheral uninformative impending facilitation anticipate benefit forthcoming occurrence predicting biasing quickly anticipation absent appearance orient expecting termed neurally return modulation humans 
9	0.03204	semantic word knowledge words temporal meaning retrieval concepts atl lexical semantically anterior inferior unrelated pairs lifg association language demands abstract phonological decision relatedness concept correlates semantics imageability controlled picture names memory associations judgments lexico concrete meanings required nouns selection level judgment lobe similarity decisions lipc modality comprehension pmtg form thought ftd sort manipulated accessing written typically triads congruous process object processed homonym job kinds judgement retrieved linking primarily organization lateralized selective incongruous amodal atls hub formal core neuropsychological spoken trials strategic thematically preferential search interaction vatl candidate syn conflicting heteromodal phonologically subserve manipulating pictures alipc dementia relations emphasized store sign 
10	0.01666	ofc orbitofrontal cortex lateral medial amygdala mofc frontal evaluation frontopolar pole prefrontal limbic systems orbital regional lofc paralimbic reward negative specifically orbito serving associations plays values functioning immediately unfavorable sectors social successful olfactocentric vigilant favorable sections declared reconfiguration temporopolar bmrmi tangible theme maneuver things responsive participated cbti hyperactive affiliative connectivities mobilization solutions sector mimics weakened regulation mediodorsal separately disharmonious bal prt fisher formula disturbs temporolateral cerebellum gustatory perd swap stc accountable existent unpalatable scalar quadruple disliked rb accounting mfc mediators concurred neuromodulators inherent awarded stem harmful likehood hyperconnected declerck cynomolgus dynorphin prodynorphin participations michigan oxycodone kindly neuromarker paints employers kovach 
11	0.07421	cognitive function performance cognition functions task functioning higher neuropsychological prefrontal impaired executive test cerebral linked measures correlates relation impairments patterns reflect individuals relationships association multiple attention suggesting poorer neurocognitive tests time impact range structural performing suggested provide represent wide battery multimodal order ii affects testing compromised worse variables years intellectual people neurofunctional diverse variety cpt psychiatric performances strategies neurological integrity subserve education included impacts measurement broadly load standardized disruptions thirty reserve flexibility populations localized postulated notably educational demand complaints marker intervention generalized intelligence investigating heterogeneity lesser implications enrichment fifty serve research points leads young traditionally adequate trajectories probed influence poor 
12	0.00858	adhd disorder attention deficit hyperactivity children boys mph medication methylphenidate group naive adolescents abnormalities adult symptoms magnetic adults typically methods impulsivity resonance conduct striatal childhood dcd td attentional drug inattention treatment problems comorbid abnormal age persistent severity cerebellar orbitofrontal cu callous stimulant persistence accd unemotional adulthood sample pathophysiology symptom poor medicated neurodevelopmental hypoactivity atomoxetine hypoactivation frontostriatal improved fxc hypoactive odd males underactivation psychostimulant normalized male anova aged iq abnormally bpsd rct cd comorbidities prevalence striato improve subgroups history psychiatric normalization shared mpx oppositional upregulated subtype medications comorbidity subgroup lpe atx hyperactive stimulants antisocial catecholamine persist symptomatology disturbed traits adolescent inattentive 
13	0.00974	fear conditioning extinction cs conditioned learning amygdala stimulus deception swallowing aversive hippocampus paradigm conductance unconditioned recall paired skin humans renewal safety truth vmpfc trace contingency ucs anxiety water deceptive telling ventromedial honest classical response pavlovian lies scr shock lying extinguished learned human appetitive lie generalization expression presented scrs swallow instructed electrical test initial unpaired animal procedure dishonest consolidation impaired associative ratings group saliva responding presentation ren truthful contingencies cxt mice electric pairing successful noren deceive neutral treatment concealed claims rodents return cit pretending served paradigms cue crime fears recovery told presentations session aba anticipatory sessions retention mediating correlates gs overgeneralization 
14	0.0056	bpd sn ifc hcs disorder personality rmdd borderline cen group ai inter salience intra female instability dacc nssi impaired phb mn lethality abnormalities ccn core sen unstable fcs fronto boi tat hot disturbed cold salient edp fic compression interpersonal compensatory trend distress triple referential severe vss dgs subareas subgroup yield cptsd machiavellianism hypersexual hyperconnectivities vsi nontraumatic ewmt ifcs welders borg edr emr monadic medicine interruption platform persistent passively medical scripts protocols limit unmedicated mta lrs wellness replenishment remediated tii lability unsynchronized manganese injurious lha administrated cc conceptualization reacting rational interactively algorithms impulse normosensitive corrrelated mindedness endeavoured mentioning adenoma intolerant intertest 
15	0.23801	resonance magnetic mechanisms underlying suggest important understood level control play provide function unknown remain key poorly mechanism suggesting higher plays central identified research relationship addition relevant largely implicated paradigm specifically relation link characterized measures substrates predicted volunteers interaction neurobiological hypothesized major implications explored fully individual roles linked importantly underlie strong induced supporting unique neurophysiological fundamental separate aim studied substrate widespread neurocognitive highly humans represents patterns regional identification goal potentially insights involving strongly significance reported development indicating versus precise participated mediating increasingly mediate providing focused representing included observations understand elusive summary affects represent explore resulting evaluated evaluate levels characteristic step relate 
16	0.01991	ad disease mci alzheimer atrophy amci mild dementia cognitive apoe early epsilon normal impaired group neurodegenerative bvftd progressive amnestic frontotemporal risk elderly degeneration loss abeta sd performance nc progression variant hippocampal amyloid impairments pathology compensatory status aging neuropsychological patterns measures patient stage burden pathological voxel deficit regional scores preclinical age episodic elders ftld severity lower deposition apolipoprotein stages precuneus intact mmse aphasia syndromes preserved biomarker neurodegeneration measure morphometry biomarkers cn integrity lewy lobar aged mini moderate prodromal detected tau profiles nondemented palsy education syndrome tests impact pib pittsburgh ftd supranuclear hypometabolism pronounced compound posteromedial marker apoeepsilon thirty seniors severe disconnection 
17	0.11341	frontal temporal parietal cortex inferior lobe superior gyrus medial occipital lobes middle network common bilaterally correlates magnetic occipito cerebellum substrates addition underlying patterns primarily conjunction lateral showing volunteers baseline pole unclear widespread gyri predominantly temporo linked junction previous type produced prominent lobule recruited process limited point rely number neuroanatomical operculum partial required relate classified whilst form revealing hemispheres authors spread orbito evident peaks correlational indication temporally thirteen preliminary share eye resistance unlike subcomponents distinguishable contrasting small obtained parietotemporal concluded segment haemodynamic passively sixteen wider stem behaviourally presentations figural imaged lobules systematic peak anatomic frequently consecutively articulate accounting note evolve disclose 
18	0.01234	color shape shapes pm texture red surface colors fmr form presented green blue colored properties cos perception achromatic identical rm frax cone geometric detection location binding discrimination fragile versus material fxs random chromatic premutation remember pop ssd circles colour surfaces property viewed spt geometrical balls attending arbitrary glossiness mrna curvature abstract identity perceptual cgg black fmrp observers ko fxtas metric vo collateral inducers conjunctions psychophysical yellow retardation hardness fxpcs cda symmetry spaceships dimming discriminated subtracting volunteers synesthesias bottles mglu sld shading tactually textures runs counted processed ratio hue latba medba catching bisensory trinucleotide bindings enclosed bulk wavelength rectangles amg mccollough 
19	0.00967	illusion physical perceived illusory contour perception attractiveness sc impression oxt illusions attractive line impressions size induced physically formation real pc perceivers phenomenon muller bad contours endowment distinctiveness judgments lyer forming unattractive owned vocalisations diagnosticity giving formed shown vibration judged discriminate perceive specifically faking hollow optical mask susceptible rated rise ventriloquist messages unified experiences retinal good arrows flash tie disposition management rating poggendorff spouse moon sell desirable touches fake beauty goods circles sized underpinnings cars alternation gave percepts parametrically transformed inversion arising characteristics snc pnc concave buy roelofs sb convex pause kinaesthetic judge repeatedly attractively dii concealment deutsch send benham wwi 
20	0.01724	wm load memory working task maintenance performance ltm high capacity prefrontal distraction increasing verbal loads probe parietal demands maintained delay demand manipulation accuracy levels resources maintain held parametric paradigm eos recruitment susceptibility encoding sternberg sample distracters probes letter secondary memoranda maintaining resource varying dpcc match dependency delayed slower item increases epochs eliminated guidance encode demanding emphasizing relevant highest temporary impairing distractibility tended coping amounts participate segregated incorrectly memorized presenting conjunction dorsolateral wkm contributor reappearance hints resist level nonconfusable confusable uag supracapacity rehearse decrements loaded pattern hypotheses downmodulation fazekas cwms designations lppc withstand spare nartiq vector formats calling distributions hot limiting 
21	0.02451	depression disorder depressed bipolar bd depressive symptoms major group mood methods amygdala abnormalities illness pg bp affective medication severity remitted limbic limitations emotional anxiety abnormal episodes euthymic mania sample negative history scores unmedicated manic state neurobiological characterized psychiatric age regulation trait vulnerability marker episode patient rating unipolar pbd iv represent treatment gender states dsm free hyperactivity inventory subgenual symptom beck pathophysiology bdi hamilton symptomatology pathophysiological recurrent ud geriatric remission antidepressant paralimbic hippocampal models medications subtypes bdd samples risk naive lifetime nineteen markers subthreshold mdd lack comorbid subtype hypoactivation frontolimbic scan method biomarker antidepressants rgd relapse severe psychopathological correlates demographically persistent 
22	0.01316	stroke recovery aphasia chronic acute hemisphere contralesional function injury cm months ipsilesional rehabilitation recovered reorganization lesion mtbi naming smc post aphasic paretic recruitment induced outcome patterns therapy plasticity improvement fe improved ch survivors scores mild treatment traumatic patient weeks ipsilateral subacute outcomes unaffected therapeutic severe perilesional neurological ischemic strokes hemispheric pedaling interhemispheric objective longitudinal recover rehabilitative impaired persistent subgroups lesions onset lesional anomia compensatory secondary repeated cl partially homologue psmc cpmd hemiparetic ischaemic injuries attack undamaged fluent repair sbp perisylvian protocol provide fugl meyer redundancy chronically infarctions artery noted hemiparesis stage pattern good lfpn sfa sdtd neuroplasticity nonparetic fully infarction 
23	0.00753	reasoning relational relations rlpfc hf fluid frontal analogical inference logical gf lf conditional analogy deductive abstract taxonomic rostrolateral rules problems ti arguments intelligence rule solving hfs inferences transitivity inductive series transitive rspm problem relation logic geometric fluiq completion equivalence premises raven emergence inferential matrices cognition capacity syllogistic induction premise brands logically relationships judgments trns deduction syllogisms falsification analogies subtask visualization ordered identification frontoparietal ave analogizing taxonomically completing formal statement elementary perceptual nonverbal verbal perform deductions reason draw judging ab progressive thinking modus propositions indeterminate obey disjunctive rapm wason flexibly jumping inclusion propositional flashes characteristic making reconfigurations fallacious saturday thursday xavier 
24	0.12461	recruitment recruited engaged suggest contrast versus demands effort suggesting systems reflect engagement required correlates pattern increases possibly recruit passive cognitive types control reflecting supporting resources common tested implicated indicating thought engage identify typically preferentially manipulation function involving selectively supported scanned supports reflects controlled demand mediate occurred require needed number limited primarily occurs type separate reveal sought goal attentional requiring reflected research form resulted scanner produced unique strongly relevant main nature difficult involve operations key minimal compensatory substrate varying prior contrasting difficulty similarly yielded requires affect mediating opposed demanding exhibit independently vary uniquely presence explicit shown requirements recruits underlies subset forms 
25	0.04835	state resting fc seed intrinsic rsfc rs rest rsns patterns sensorimotor strength fcmri fluctuations states abnormal measures independent approach voxel seeds rsn scan scans obtained provide relationship structural addition identified fcs maps extrinsic characterized relationships unclear organization connectivities spontaneous suggest integration explore insights functions calculated shown pathophysiology properties association disease global frequency rois method nodes inter functionally hyperconnectivity selected rsfmri local rsfcs architecture weaker limited pathological evaluated total divided neuropsychiatric analyzing characteristics strengths disturbed insight session parameters serve intra exhibit representing males hypoconnectivity synchronous understand major voxels secondary synchrony disconnection marker seeded fluctuation steady datasets minute variables comprehensively wise wakeful 
26	0.04862	time delay temporal period delayed periods interval long onset intervals phase short delays longer sustained initial match min maintained cp events sample offset static occur window multiple phases prolonged series paradigm timing point prior gradual seconds length peak shown shift temporally larger immediately points estimation future small variable durations occurred precuneus subsequent identify lasting probe persistent gradually sliding scales fixed occurring windows evident minutes stable maintaining term early res separated rapidly preceding termination reproduction shorter times reaction discount focused moment maintain retention sec tone possibility locked slowly starting occurs successive recruitment unique start sustain online intervening ongoing hemodynamic evolving spent 
27	0.03925	response time reaction task selection times rt stimulus longer pre slower accuracy rts motor simple sma speed paradigm selected shorter choice process respond indicating correlates free action latencies cognitive performance adults slowing selecting parallel required select prolonged mapping responded press correct supplementary irrelevant led subsequent visual specifically speeded rapid neuroimage generally pressing located locked slowed slow manual fastest alternatives law latency responding constraint buttons automatic seconds speeding row amplitudes trial nogo percentage thal committed prp tssp slowest subprocesses succession hypothesized manifesting constructs pc div implies novelty initiation ensure presupplementary fourth concurrence wholly longest asynchronies confounded pixels ng tasking sato eliminated 
28	0.02834	memory retrieval episodic recollection memories autobiographical recall hippocampus events recognition familiarity semantic hippocampal context retrieved lateral reactivation recency suggest temporal medial source remember parietal remembering remote past item retrieve engaged successful supporting parahippocampal correlates encoding posterior monitoring ams precuneus reinstatement strength recollected schema items pattern recalled specificity contextual mnemonic knowledge personal studied familiar retrieving strategic consolidation prior episode implicated search lobe scanning neocortical experiences cues remembered trace encoded supported reflects fok recalling linked laboratory cued words recollective traces recollections personally success mind storage confidence richness metamemory correct episodes retrosplenial previous learned controlled literature knowing recently feeling reactivated relies rich newer 
