0	0.02953	stimulation somatosensory tms tactile primary rtms touch motor transcranial tdcs applied induced magnetic sensory secondary stimulated repetitive ipsilateral swallowing areas representation healthy stimulus system evoked intensity human finger perception somatotopic site excitability volunteers pulse vibrotactile sensorimotor skin leg rest electrical single afferents body unilateral delivered anodal threshold coil hz plasticity input discrimination mep active induce fingers current index direct dbs ct frequency forearm cm activations water neurophysiological roughness surface distal effect order paired real tbs touched cutaneous galvanic increase position proprioceptive muscle inhibitory cortices reflex neck afferent local inputs affected session cathodal remote stimulations guided inter locations itbs proximal projection 
1	0.03362	human humans animal neurons monkey evidence primates animals monkeys suggest lateral ac species macaque structures nonhuman ca contrast primate similar interactions electrophysiological recordings demonstrate circuit single evolved properties proximity topographic core organization formation homologue upper neuron demonstrating unit robot equivalent body anatomical cell basic pathway evoked computer putative respond opponent evolution artificial firing direct rodent classical located systems resolution sites bnm mouth delineated question agent homologous lgn rats schema evolutionary macaques imply mammals rodents system translational avatar ensemble consists combined series pathways vegans anesthesia conspecifics resemblance belt awake robotic resemble dog living position vegetarians likeness layers physiology transferred retinotopic topographically 
2	0.00888	smokers users smoking drug nicotine cocaine cannabis craving cues controls abstinence dependence cue addiction dependent heroin marijuana induced exposure cigarette control abstinent compared heavy mj chronic ecstasy abusers addicts abuse mdma nonsmokers withdrawal conclusions altered impulsivity increased reactivity individuals treatment addicted drugs neutral tobacco current hdis cd relapse cravings objectives seeking lifetime cessation stimulant addictive recreational begin patch nondrug severity underwent behavior reported methamphetamine duration positively term cud reduced scanning neurocircuitry nonsmoking regular alterations development deficits clinical hypoactivations stimulants pack naive intensity smoke deprived para thirty satiety compulsive education neurobiological attenuated male correlated conditioned teens satiated urine daily factor adult 
3	0.24249	effect increased participants level behavioral compared interaction increase levels reduced influence increasing suggest enhanced investigated factors modulated decreased experiment modulation affected increases revealed shown number conditions tested stronger previous examined size impact affect varied induced degree current influences influenced complexity underlying difference led manipulated similar varying context reduction factor addition reflect paradigm amount additionally reaction larger correlates interactions reported hypothesis resulting decrease demonstrated combined unclear neuroimaging lower sensitivity independent modulates decreases remains explored experiments finding subsequent lead demonstrate examine terms measured accompanied behavioural conclude relation mechanism assessed reflected phenomenon measures relationship evidence leads affects induce correlated suggested attention parametrically times 
4	0.01406	stress ptsd exposure trauma cortisol disorder traumatic life exposed posttraumatic acute childhood response reactivity stressful healthy survivors symptoms reported anxiety disorders increased severity levels stressor combat control symptom maltreatment veterans individuals experiences events abuse responders recent induced conclusions els ipv psychological earthquake axis chronic chewing regulation reduced current decreased cem psychosocial development participants risk hpa vulnerability traumatized salivary history deactivation stressors cg caps dissociative threat mental association sles blast stressed reporting physiological responses experienced underwent severe controls term emotional cells exposures adverse provocation adrenal neuroendocrine circuitry neurobiological negatively prolonged endocrine psychopathology depression situations patients oxt military adversity responsivity health reduction 
5	0.02238	disease patients ad mci alzheimer controls cognitive impairment atrophy mild amci healthy dementia memory hd deficits elderly clinical apoe age performance mri epsilon impaired sd loss neurodegenerative progressive normal neuropsychological amnestic degeneration reduced compensatory progression adults risk pathology dysfunction matched decline cognitively voxel episodic decreased test cn onset increased aging stage abeta stages amyloid mutation individuals impairments alterations huntington burden bvftd pathological deficit nc beta measures function lateral assessed cholinergic diagnosis cognition scores preclinical education lower mmse severe lobes ftld altered underwent behavioural variant carriers diseases examination late patient hfc clinically integrity pre gray deposition apolipoprotein regression preserved mini symptomatic 
6	0.04547	object objects visual shape color recognition stream shapes areas perception activated location lateral grasping haptic processing texture form selective colour properties features manipulation orientation grasp participants identification visually perceptual reaching viewing naming discrimination size matching tools knowledge intact pathway real surface contrast streams images colors geometric manipulable pathways feature preference requires viewed line observers drawings natural identical visuo reach performed substrates pictures abstract achromatic bilaterally named action perceived produced propose dimensional graspable experiment observer blue identity specialized space recognize grasped scrambled neuropsychological vision touch canonical adapted animals detailed interactions haptically tested neurologically colored constant rvf chromatic input exploration hv climbing 
7	0.01137	phase rate cycle heart menstrual autonomic phases women physiological exercise sympathetic luteal hr follicular cardiovascular msna pmdd pressure breathing mid reactivity central cardiac levels progesterone athletes modulation peripheral circuitry respiratory recorded arousal hf variability breath estradiol hrv generation intensity frequency cpap premenstrual endurance rates oxt outflow parasympathetic nausea air oral late aerobic period lf hypoxic protocol concussed tidal withdrawal elevated challenge disease muscle cycling hormone tone contraceptives ncs bursts hormones holding sleep acquired neuroimaging spn ss slow nervous input reactions lbnp multiplicative hypercapnia bp health urgent stress hypercapnic continuously repeated heartbeats ovarian apnea obstructive estrogen naturally regulation covaried afferent attenuated 
8	0.08598	connectivity functional network resting networks fc increased seed connections decreased patterns analyses correlation correlated rest strength rs coupling rsfc suggest stronger interactions intrinsic altered examined regional integration correlations revealed inter cortices nodes connected provide graph interaction properties demonstrated identified local scale fcmri alterations global disrupted investigated reduced hubs sensorimotor examine hub weaker maps independent organization investigate including understanding exhibited circuits coherence voxel connectivities pattern cortico range defined relationships remains suggests functionally psychophysiological scans motor disorders measures measured key structural structure metrics node efficiency communication disconnection collected driven examining rois connection theory unclear highlight fluctuations finally fnc topological widespread enhanced insights 
9	0.06663	attention attentional visual spatial search orienting target top selective control location areas attended network stimulus irrelevant cues distraction shifts relevant feature modulation task cued mechanisms color cueing focus bottom processing attend event endogenous cue attending allocation directed resources modulated perceptual targets invalid selectively divided exogenous locations dimension enhanced investigate selection cortices reorienting unattended driven junction central sensory detection visuospatial distracters voluntary covert capture peripheral valid signals conjunction distracting eye alerting sustained shifting display shift spatially modulate biasing features orientation networks salience representations ignore distracter directing modulations nonspatial hemifield relative simultaneously influence biases ant vpc singleton dimensions engagement validity saliency conclude 
10	0.36577	network processing distinct evidence common suggest previous including mechanisms neuroimaging support analyses specifically engaged systems revealed current underlying remains unclear provide previously types addition information investigate implicated question extent research similar role tasks substrates overlap independent examine patterns pattern identified demonstrated unique recruited core demonstrate overlapping type issue level relative critical suggests suggesting involving behavioral examined linked components shown shared networks aspects set address relationship dissociation process reflect active time involvement sensitive report separate reflecting recent nature paradigm contrast relevant correlates involves forms distributed addressed domain suggested share modulated reported focused understanding established engage represent degree recruitment importance contribute selectively 
11	0.02637	pattern patterns classification accuracy multivariate features feature univariate classifier mvpa machine diagnostic expression voxel identified identify cc decoding vector svm distributed predictive analyses support prediction discrimination applied individual multi multivoxel chemotherapy classify discriminative sensitivity discriminability discriminating voxels information specificity classified covariance searchlight predict predicted learning bla cancer classifiers correctly neuroimaging discriminated partial extracted decode regression testing squares allowed discriminant synesthesia trained discriminate techniques predicting tsd pls included decoded grapheme validation characteristic spatial recognition biomarkers distinguish evaluated differential obtained highly diagnosis breast synesthetes classifications optimal algorithm status accurately conjunction index expressed train standard classifying sparse machines receiver synesthetic distinguished achieved sfa 
12	0.22647	areas activated network activation activations including compared revealed subjects networks contrast investigated cortices similar additional visual common involvement comparison bilaterally stronger correlates pre order strongly paradigm elicited active recruited design process activate reflect distributed experiment induced neuronal differential conjunction widespread single studied direct engaged produced additionally motor lobes lateralized included employed performed presentation junction suggesting central event conclude confirmed contrasted set shown includes comparing comprising identify previous component addition components extensive healthy association activates recruit consisting led highly independently relation overlapping patterns commonly identical separate analyses absence partly yielded involve extending basis compare differentially required respect predominantly recorded requires confirm 
13	0.09784	cognitive control performance task executive function functions cognition ability attention behavioral tasks functioning test goal effort individuals behavior demands recruitment abilities lateral performed attentional neuropsychological directed domains tests level individual relevant behavioural evidence speed performing impairment stroop deficits impaired domain including investigate impact efficiency requiring supporting continuous support battery engagement maintain correlated correlates assessed effortful measures linked completed exhibited measured examine resources specifically sustained planning key skills aspects cognitively worse demand strategies predicted reflect suggesting demanding load reflecting assess whilst slower targeted relationship supports maintenance neurocognitive maintaining errors designed impair intervention assessing variables subserving measure arousal challenging exert flexible solving 
14	0.02443	wm imagery mental imagined rotation mi tasks visual visuospatial motor areas spatial ltm imagination imagine transformation image imagining mentally images activated ability angle degrees physical strategy manipulation visuo poor actual rotations simulation kinesthetic gifted representational clock angles rehearsal future instructed neuroanatomy contents involve role ayahuasca imagers represented performed vividness visible reversal notes supplemental disparity relies expected percept chronometry dimensional strategies subjective complete uhs fhs parity vivid encourage excluded prompted engages transformations humans vmiq prismatic biomechanical visualization laterality injury generate real top identical operations spimg adopt syn neuro student magnitudes version wide mirror labour grd immigrants nsp trance mx orchestral giftedness 
15	0.03681	reading words language word phonological processing chinese visual lexical letter readers letters orthographic naming dyslexia characters native languages bilinguals japanese dyslexic semantic character form speakers linguistic spelling pseudowords production representations written activation writing tasks phonology rhyming bilingual task recognition vot suggesting strings picture orthography spoken alphabetic system proficiency late pseudo suggest single acquisition kanji compared meaning pseudoword skill decision korean speech proficient sound access aloud mapping dyslexics spanish visually developmental similar articulatory monolinguals phoneme judgment consistency mid acquired nonwords properties pairs logographic skilled print text rhyme auditory fluent sublexical speaking skills span pathway normal decoding silent forms units semantics frequency 
16	0.04213	target detection stimulus targets response processing responses novelty change events task distractor oddball distractors event salient salience driven context relevant paradigm presence relevance unexpected habituation information effect irrelevant behavioral role hemodynamic detect deviant potential mismatch participants infrequent detecting presentation contextual respond suggesting rare mmn previously responding standard suppression unrelated automatic detected evoked explicit sensitivity probability elicit saliency environment behaviorally absence isolation deviance enhance relative responded frequent predicted match tones modulate tone evaluation enhancement triggered junction determine pop deviants rarely expected amplitude reported studied looming suppressed pair nontarget matches enhanced designed repeated occurrence purely speeded standards responds negativity latencies sudden faster 
17	0.05222	social empathy participants person mentalizing mental people mind cognition theory perspective interaction game behavior interactions junction individual attribution human empathic interpersonal situations attachment emotional intentions taking beliefs understanding affective partner exclusion situation activated individuals ability personal socially physical intentional cooperation cognitive partners guilt perception unfair inference belief rejection behaviors experience friend inferences offers played computer agents trust inferring intention behavioral distress perceivers situational thinking participant basic nonsocial stories infer impressions character contexts scenarios tendency evaluation context play representations cooperative relationships feelings fairness scanned perceived consequences understand behaviour motivation prosocial reputation reasoning experiences competence ultimatum harm implicated attributions socio emotions paracingulate 
18	0.13468	subject individual measures variability single level techniques sensitivity clinical test obtained robust provide analyses reliability tool model approaches reliable measure experimental inter highly set applied detect variance developed signal patterns derived information potential assess parameters including conventional estimates statistical local sample sessions range procedure standard sensitive provided maps quantitative application paradigms widely scan detected research correlation regression defined modeling combined technique values limited resulting functions commonly sets session alternative finally population design participant evaluate average optimal variation investigating additional populations combination models methodology expected yielded difficult mri multiple utility combining parameter powerful future distribution partial tests significance specificity estimate reliably 
19	0.26045	evidence hypothesis role model consistent support function models recent provide neuroimaging cognitive process current research suggest theory previous test tested account suggests proposed predicted theories finding structures view order supporting hypothesized literature specifically human context involvement previously implicated basis critical nature suggested predictions supported systems terms supports internal recently direct hypotheses propose accounts play discussed directly predict theoretical central degree structure idea neuroscience provided computational mechanisms alternative report key plays line domain understanding functions demonstrate explain suggesting past notion extend dual established framework contributions primarily mechanism requires contribution existing basic considered mapping linked predicts perceptual explained highly discuss developed growing 
20	0.04286	semantic words word priming processing knowledge abstract conceptual category representations lexical concrete concepts meaning pairs task unrelated retrieval categories picture decision atl activation representation semantically prime pictures association automatic information participants relations verbal similarity effect consistent features controlled concept behavioral relatedness items objects living implicit primed perceptual names access modality animals matching correlates represented semantics primes decisions object nouns modulated relative explicit demands independent required associations animal judgments typically written form abstraction memory degree types judgment domain highly grained activate masked categorical organization selection context denoting sort integration determined visually evoked taxonomic feature distributed grounded representational mechanisms coding naming classification 
21	0.01887	context gaze cues contextual contexts congruent incongruent direction direct eye information social subliminal interaction contact arrow unconscious averted suggest relevant effect shifts embedded cue reality directional conscious congruence incongruous incongruency supraliminal actor mimicry triggered congruous modulate predictive modulation background combinations conveyed expectancies origin tuned encounter incongruence upward influenced perceived pairs ifs subliminally congruency predominantly setting masked place predict expressed observer symbolic visible curiosity downward evoked interpretation subject virtual danger conversely facilitate preceded previously indicating detection arrows contextually blocks eyes relevance signal automatically dmns supraliminally profession settings looked compatibility addressed unconsciously conveying rightward person joint modalities oeams ens stereotypically spotlight occupation 
22	0.02441	depression mdd patients disorder bipolar depressive depressed major healthy mood bd anxiety sad controls conclusions symptoms subjects disorders control severity compared increased emotional antidepressant matched abnormalities illness clinical rumination affective hc trait emotion dysfunction medication subgenual individuals limitations relative anhedonia abnormal remitted euthymic altered reduced analyses unmedicated characterized treatment negative psychiatric regulation gender sample current unipolar vulnerability pathophysiology mania alterations episodes symptom episode manic pbd bp implicated history naive paralimbic hcs research onset antidepressants free neurobiological dysregulation anxious underwent pediatric age samples risk completed rmdd hyperactivity diagnostic features represent remission circuit duration subclinical comorbid future circuitry bias geriatric markers contribute 
23	0.00524	acupuncture creative stimulation creativity acupoint ideas pc thinking generation verum acupoints needling variability idea gb va specificity laser responses activities deqi divergent deactivation iiv manipulation clinical te original evoked produced glycemic electroacupuncture explore cognition expansion originality unusual chinese superficial teas ea placebo focused therapeutic sensorimotor psychophysical dh ra eas needle traditional ideation pinv nap produce paralimbic deep adhesion medicine adaptability moderately synchronization effective manual real multiple vision defined system religiosity magical tcm decomposition interindividual induced amygdalar repeated scans gvc inventive ve acupuncturists mor aa appropriateness hegu conceptions prone poles nervous novelty drama theatrical spa needles ub creatively lr liv artistic 
24	0.06204	memory encoding retrieval recognition episodic words successful subsequent items recall test information recollection item associative word participants source studied encoded event performance pairs memories formation success remembered associations verbal pictures remember correlates context term material support predicted phase strength semantic suggest judgments relative declarative binding incidental correct relational monitoring lateral retrieved learning forgetting reactivation prospective paired engaged recognized subsequently familiarity identified accuracy picture contrast remembering correctly accurate including intentional trials deep mri consolidation elicited confidence mnemonic forgotten tested enhanced previously paradigm neocortical scanning details retrieve supported cortices unsuccessful contribute successfully list suggests events cued shallow face recollected contribution mediated reinstatement 
25	0.03306	inhibition response control inhibitory stop task motor signal activation trials nogo suppression responses successful inhibit behavioral error inhibited inhibiting pre performance prepotent reactive stopping ability sst monitoring suppress correlates gating action rifg success proactive errors tasks required participants voluntary behavior initiation execution failure responding correct impaired executive intentional hypothesized tendency inappropriate compared performing impulse requires signals failed automatic rifc ssrt failures unsuccessful dominant reaction presupplementary regulatory withholding stereotyped successfully modified voluntarily primary unwanted tendencies commission behaviors mediating pne midcingulate suppressed underlying cancelation inhibitions rai overcoming initiated free conflict behavioural frequently subcomponents triggered impulsive restraint concurrent plans controlling cancellation slowing intentionally 
26	0.0115	reho risk regional relatives genetic resting siblings homogeneity unaffected degree spontaneous hs compared values mhe individuals abnormal rs local decreased environmental ws twins factors pairs test familial lod concordant abnormalities cirrhotic fr twin identification discordant altered increased trd vulnerability heritable synchronization hfs encephalopathy alterations parents influence age monozygotic genetically trait sex lobes dz endophenotype hepatic explore hm mz risks evaluate sample duration scans esrd microgravity eod std hayling hr synchrony predisposition correlations changed fhr probands concordance endophenotypes family tests heritability liability fd minimal sentence difference mcc venous developing completion pathophysiological anova analyze baseline rap ammonia nonpsychotic simulated hoc psychiatric activities 
27	0.02372	placebo dopamine healthy administration mg drug double blind effect ht dose receptor reduced treatment design controlled dopaminergic acute serotonin volunteers induced response randomized pharmacological ketamine oxytocin atd methylphenidate crossover single function increased depletion levodopa mph administered conclusions receptors received humans antagonist disorders opioid challenge modulation drugs oral decreased selective dopa reuptake neurotransmission modulated tryptophan inhibitor sessions saline increases increase citalopram potential epo agonist central system cholinergic medication objectives modulate reduction assessed gaba session combined attenuated levels inflammation il serotonergic modulates measures counterbalanced pathophysiology male thc intranasal days scanning kg completed infusion change neurotransmitter psychiatric altered alpha baseline ot vasopressin doses 
