84	0.0262	risk adolescents individuals history behavior intelligence participants psychosis aggression adolescent family relationship taking youth lower factor examined circuitry factors relationships impulsivity nirs negative support aggressive fluid positive association completed adult examine fh reduced function development onset adolescence sample behavioral reported adults disorders parental reasoning reactivity functioning age sensitivity developing iq gf measures assessed health vulnerability females systemizing reactive potential status impulse schizotypy impulsive frax measured aged addiction predicts heightened conclusions familial tested expression impulsiveness prone maoa community twenty fhp chr empathizing internet associations sex presence acceptance histories pressure families underwent genetic predicted exhibited igd proneness questionnaires quality ages lead defined 
85	0.03728	feedback error errors learning prediction monitoring correct negative performance response outcome reinforcement positive trials processing outcomes task trial reversal behavior stimulus expected signal detection signals events expectations incorrect expectation predictive contingencies correlated event reward contingency adaptation probability adjustment actual unexpected ern associations goal adjustments actions increased received shift predictions subsequent predicted provided learn time probabilistic ability learned action rates adjust responding correction critical rcz omission accuracy future pe rate types erroneous representation environmental commission receiving behaviour change probabilities informative signaling directed evaluation corrective likelihood generated environment zone associative surprise instrumental frn committed estimation consequences behaviorally conflict adaptive negativity updating distinct 
86	0.03951	speech auditory sounds processing music sound perception voice pitch listening acoustic musical production vocal tones prosody musicians voices tone phonetic responses syllable linguistic listened syllables speaker noise discrimination prosodic primary stuttering spectral listeners vowel language singing melody speakers spoken ear heard intelligibility stream vocalizations perceptual dichotic natural native complexity articulatory passive integration hearing stimulus consonant comprehension perceived frequency environmental speaking tonal features degraded intonation phonological experiment sensitive produced repetition nonspeech phonemic identification signals intelligible vowels melodic lateralized recognition responded audio variation duration verbal normal articulation sequences conditions communication melodies harmonic evoked syllabic identify sentences singers phoneme overt words design bilaterally 
87	0.02938	sentences language comprehension sentence processing syntactic semantic linguistic meaning word literal narrative ambiguous metaphors content meanings structure syntax discourse ambiguity spoken story violations reading event participants context metaphor text speaker coherence integration speech order words complexity types relative pragmatic metaphoric subject initial natural quantifiers stories unification opercularis listened figurative role interpretation dependencies distance dominant irony hemispheric recruited demands examined elicited modulated conventional violation inference grammatical information prosody line metaphorical perisylvian listening unambiguous syntactically coherent object correct structures manipulated semantically domain contained accent aspects subordinate endings supports situation prosodic clauses communication gap embedded resources lexical selective phrases passages construction arguments semantics 
88	0.02837	motion perception visual biological areas moving processing direction dynamic static stimulus human illusion sensitive depth perceptual dot cues subjects order coherent displays illusory perceived viewing stationary dots flow form percept random movement optic structure figure coherence signals experiments shape viewed elicited lsf illusions dimensional disparity discrimination attributes hsf luminance apparent lateral vision experiment evoked detection percepts retinotopic pathway eye types strongly defined okn binocular directions directional phase grating horizontal responsive process specialized sfm rigid psychophysical attribute thresholds transitions observers bistable rotated retina rotation scrambled segregation albinism optokinetic displacement perceiving retinal global lyer egomotion gravity perceive velocity input fixation randomly rm 
89	0.01328	awareness conscious expertise meditation consciousness experts mindfulness aware novices er experience meditators con disgust unaware level practice focus mind novice reflection training consciously subjective np reduced automatic experienced sport correlates levels visibility reduction practitioners compassion mbsr sedation concern lt mindful rivalry sm stress lkm hockey players vegetative propofol ethical unconscious perception masking backward automatically sle penetration ia experiential appraisal induction contingencies advice unawareness anesthesia flows relaxation eliciting reducing perceived iaa archery automaticity athletes breathing access everyday practices decoupling introspection evaluative reduce producing attenuated fam ar meditative contamination reflective development possibility tcc ots zen coma participant locked sports covert nonsingers esup 
90	0.02145	familiar recognition false familiarity items unfamiliar item true correct famous stm vstm information confidence names recollection prc compared activated recency person people belief contrast order personally heuristic term hits relational associations knowledge types rejection fs finding experiment learned representation judgements identification lateral reality processed processing alarms ls ltm hit lag previously unrelated scientific ti incorrect reflecting misses transitive possibly automatic prototypes list alarm newly yielded rejections accuracy assumed stored answers innovation lists respond lures primacy rejected detected recognizing contribute process sequence aa rhinal prototype earlier cer retrospective triplets top pairs position titles discontinuous technical storing title studied nsi drm oldness 
91	0.01728	pet flow tomography emission positron cbf perfusion regional rcbf metabolism glucose metabolic asl resting arterial spin labeling baseline increases binding rest mri fdg measured normal association cortices technique physiological spect relative rate decreases bp fluorodeoxyglucose detected hypometabolism decrease change potential vivo fluoro release underwent global voxel continuous cck elevated scans determine availability energy correlated oxy raclopride pulsed caffeine ml receptors measurements consumption bilaterally water ssna pcasl concurrent hypoperfusion reductions labeled casl cmro deoxy neurovascular uptake modalities computed persistence tot quantify partial roi measuring natural coupling constant decreased photon occurred hypoglycemia absolute scan noninvasive cohort observations rapid pathways stimulation sert pasl 
92	0.08514	bold signal dependent level response oxygen signals oxygenation change increases neuronal increased increase relationship subjects function measured decreases intensity responses primary correlation decrease fluctuations healthy human correlations amplitude correlated spontaneous levels contrast consistent negative sensitive magnitude simultaneous hemodynamic variations acquired positive deactivations measures parametric increasing percent variation induced baseline noise recently interpretation dependence approximately frequency detectable spatial demonstrated extracted correlate dependency percentage suggesting amplitudes exclusively caused suggest collected vigilance vascular global spectroscopy concentration measure glutamate manner trend revealed augmented maintained close attributed hemoglobin measurement exhibits covaried evident exception recording observations steady consequence awake ratio reflects secondary conventional psc hb modeled 
93	0.01596	eye eyes movements target saccades saccade visual tracking guided pursuit fixation closed movement saccadic gaze oculomotor antisaccade direction ocular areas control spem visually smooth blink targets position blinking retinal peripheral subjects volitional execution motor directed reflexive voluntary moving antisaccades continuous velocity step degrees presentation signal signals evoked system motion pro darkness human latency nystagmus extraretinal generation prosaccades blinks directional humans reaching reach goal instruction visuomotor prosaccade anti predictable attentive stimulation predictive latencies exploration active directions executed delay velocities suppression positions track bold paced complete fixations command transformation stationary ms fixating remembered portrait optic maintaining video responsible recording centrifugal eog unpredictable 
94	0.09277	correlated positive negative correlation positively pd scores negatively correlations relationship individual scale association subjects assessed healthy measured test score correlates regression performance associations relationships regional multiple task measures values analyses index levels decreased correlate investigate measure function inversely average sample assess adults rating predict severity mechanism stage studied relation completed evaluated questionnaire lower shown amount outcomes demonstrate degree evaluate total suggesting controlling inverse variables linked ratings status thirty people administered line twenty considered scales focused relate increasing efficiency calculated dopaminergic purpose population variability tendency markers rate taking correlational inventory correlating poor modulate magnitude time pallidum relates covariates forty experiences age 
95	0.06816	motor movement movements sensorimotor primary finger areas control activation sensory execution somatosensory functional planning tapping system ipsilateral tasks pre visuomotor cortices simple healthy performed visually action handed effector dominant representation writing upper arm feedback patterns voluntary paced sequential circuits guided representations executed index thumb secondary hands increased subjects flexion phantom cortico reaching mri studied actions extension effectors fingers loop externally circuitry triggered role coordination integration output preparation involving limbs dystonia cued internal associative loops initiated manual body activated circuit somatotopic perform kinematic bilaterally rehabilitation proper moving contribution performing wrist overt opposition transformations actual hz paralysis online unaffected input initiation tracing 
96	0.01705	frequency alff hz amplitude resting fluctuations spontaneous slow falff frequencies values fluctuation fm oscillations bands neuronal intrinsic rs increased spectral tremor hf modulations decreased fractional correlations lf range correlation rate widespread significance signals regional envelope decrease rates acquired dependent dynamics measurements amplitudes processed lower modulated rest sivd lfo spectrum measured pw oscillation filtered essential maps scales characteristics information nbr vascular relate evoked analyzed rfmri lfc scans lfos lff physiology typical khz magnitude term computed pbr synchronicity intrinsically vns alteration total emerging hfc pass covariance pdtp oscillatory proportion properties sinusoidal lft harmonics lffs bursts augmentation unknown exhibited rsa timescale toolbox ranges 
97	0.01976	fear threat conditioning responses anxiety cs extinction conditioned stimulus learning response aversive skin conductance acquisition autonomic subjects increased shock threatening scr arousal anxious avoidance participants paradigm disorders unconditioned startle paired cues reactivity humans anticipatory responding differential trace trait classical contingency enhanced evoked danger neutral heightened animal ucs safety ratings phase pavlovian trials anticipation avoidant expression learned shocks eyeblink generalization defensive electric coping signals scrs appetitive extinguished recall subjective safe dental gsp threats electrodermal physiological phasic reflex exaggerated delivered correlates repressors phobia bed prepulse assessment pairing associative successful terminalis subgenual psychophysiological electrical initial rapid renewal potentiated unpaired acquired presentations survival regulation 
98	0.00975	food taste weight obese eating foods obesity reward energy gustatory hunger pictures response caloric body insulin calorie control intake bmi mass cues dm women normal pleasantness satiety increased appetite individuals overweight responsivity glucose flavor consumption lean index fasting visual chocolate binge fat sight central somatosensory receipt hungry regulation increases health bed homeostatic behavior water images sensitivity palatable kg viewing umami overeating meal content design gain sucrose appetizing exposure primary fasted appetitive future restriction dietary feeding fed signaling ratings thirst neuronal term postprandial dieters unhealthy commercials habits gastric wine liquid pws contribute snacks sibutramine eat satiated ingestion overnight salty tastes delivery 
99	0.03082	reward anticipation monetary processing rewards motivation incentive responses motivational task loss punishment aversive rewarding outcomes gain system sensitivity dopaminergic pg mesolimbic response positive cues money anticipatory delay gains behavior avoidance outcome circuitry appetitive losses participants magnitude salience gambling anticipated receipt feedback dopamine rewarded expected neutral delivery reinforcement cue individual motivated anticipating implicated humans sn pathological behaviors punishments predicting pleasant predicted phase anhedonia incentives mofc salient mid valence circuits decreased received learning anticipate seeking impulsivity dependent addiction contingent potential relative ratings losing winning future activations pleasure game predictive functioning modulated guessing involve obtain gamblers mesocorticolimbic dysfunctional undergoing depends card magnetic lose 
