86	0.01501	ips number numerical intraparietal numbers magnitude sulcus symbolic parietal distance dd representation numerosity digit small digits size large arabic estimation quantifiers nonsymbolic magnitudes quantity counting larger arrays quantities abstract symbols line letters dyscalculia congruity sulci dots notation fractions numerals adults represented numerosities mental physical processed length judgments quantifier approximate recitation hips ordinal precise natural distances format lobe snarc nonnumerical mathematical generalized ordered theory smaller presentation subitizing notations values leads arrangements usage lip concepts pairs nagari ang numeric numerically cardinal arithmetic performing acts sparc decimals dipsa quantification decide compatibility symbolically analogue hip perisylvian fraction subtypes horizontal categorical idea integers cbs underestimation 
87	0.00766	ptsd trauma stress disorder traumatic mothers maternal childhood posttraumatic symptoms abuse veterans severity limbic combat child maltreatment history ipv mother survivors post caps group methods dissociative symptom resilience response earthquake individuals blast cem versus traumatized depression risk military fathers war parenting stressful experiences hippocampus early severe psychopathology regulation events paternal gwv resilient violence adverse development victims care acute anxiety caregiving disaster offspring abnormal months ctq gulf bonding freedom deployment vulnerability script provocation chronic ill reporting scale concussion age ptss maltreated hyperresponsiveness afghanistan lifetime urban clinician iraq accidents exposures interpersonal women personnel ids numbing wenchuan hyperarousal responsivity enduring postpartum nontraumatized symptomatology 
88	0.0693	network frontoparietal identified independent salience large scale multiple core nodes interactions identify time functionally provide central mechanism included specifically fnc highly engaged spatial engagement cognitive includes involving relevant characterized common approach executive lateralized set model multivariate hypothesized supports test perspective specialized providing supporting relation reflecting input supported subserving humans widespread putative parts node series structures explore integrated principal cross interconnected hub partial weaker participate occur exhibits roles forming integrate select mediating propose suggestive segregated revealing rise spatiotemporal map served include occurring interactive main maintain imply posteromedial readily potentially valuable signature dominant adapt comprises comprise identifies overlaps motivational technique anchored serving 
89	0.0175	pfc prefrontal cortex lateral medial dorsolateral ventrolateral control igd dorsomedial internet engaged elaboration ventral rostral mediated suggest rostrolateral gaming exhibit iad roles ventromedial maintaining multiple addiction subregions young executive oas rpfc mediating abd searching foresight divided vac lateralized randomness initially iga coactivated emphasized period sequencing unrelated cbi yas distracters alphabetizing hypothetical rostromedial specification lives occupied engaging mechanisms explorers wiring cias rgbc sharedness reassuring kernel tandem pfcs super lowered owing adaptability imagine regionally shaped gcis columbia encephalic tomp rgmv prema approximating organizes intergroup ssvac subgoaling stabilizing determinant formation influenced forces mentally indicating tagamets bpr prejudicial dorsoanterior caressing hastily inapplicable incuding levy 
90	0.01681	imagery mental rotation imagined imagination imagine transformation process image images mentally vividness imagining visuospatial overt patterns scanning physical rotations angle kinesthetic clock rehearsal rehabilitation angles simulation transformations instructed viewpoint generation tica rotated mask generate visually vivid neurofunctional presented trance ki rotating rotational reversal mechanisms programmes script selected periods chronometry hda draw suppression relies protocol parity biomechanical preventing elaborated occipitoparietal pdcd vmiq derogatory dpm vividly alternately questionnaire visible foot mediumistic labour palsy visualization disparity altogether corroborated mirror mediums hlt cascading bbb sack mx tae enact metzler sphere weighed wedges tight situated figures seeings cas remarks unskilled prompt shepard talking integrations command 
91	0.02699	movement motor movements finger hand force premotor control bimanual sensorimotor tapping primary grip contralateral execution parietal visuomotor ipsilateral cerebellum index tongue voluntary pmd simple sequential supplementary handed thumb magnetic emg unimanual volunteers forces paced kinematic precision fingers flexion hypnotic executed opposition amplitude isometric dorsal kinematics repetitive production precentral hands visually phase rest perform guided parameters wrist sequencing initiated unilateral patterns initiation online cursor output parallel sequence hypnosis involuntary planning velocity mirror skilled performing direction produced command coordinated trajectories dominant increasing somatosensory smc mr static directional writing point alien moving readiness pmc abduction hz preparation presses reaching recorded transformations speed muscles 
92	0.01896	executive control functions function cognitive task prefrontal attention sf functioning demands central simultaneous stroop counting number interpretation measure psychomotor bed strategies microgravity oriented manipulation inhibition multilingual ongoing hdbr impair confer analog meet cch mmd interpreting rng spaceflight vci hdt falls alleviate subfunctions exploration tilt computerized hybrid selectively neurite interpreters balancing pathologies disrupt revised capacities sought shifting tcns flight dispersion heavily spared head loaded dysexecutive suggested npsr astronauts ots inactivation hlb demographically stops node adaptable conferred generation pump book ipg organizes bilingualism manages outputs acceleration subtractive supplemental fluctuating prevalence orbital putamina ties trainee polyglot missions rlatfef nonvci moyamoya tnns dice falling 
93	0.02982	language sentences comprehension sentence syntactic linguistic pars semantic broca temporal meaning literal narrative posterior opercularis inferior discourse metaphors story triangularis spoken syntax production read reading speech listening metaphor text lifg word hemisphere stories presented pragmatic context german structure listened irony metaphoric short figurative natural meanings hemispheric unification wernicke speaker auditory types conventional line frontotemporal integration passive metaphorical grammatical syntactically dependencies core contrast passages endings perisylvian orbitalis ironic manipulated constructions difficulty sarcasm utterance clauses relations semantics supporting gap structures narratives preceding violations portion receptive supports picture anomalous anomalies sentential question main interpreted idiomatic texts distance statement construction subserve semantically length embedded 
94	0.01027	allele genetic genotype gene risk rs polymorphism httlpr genes dat drd transporter repeat variation variant serotonin association variants snp individuals homozygous la receptor homozygotes nucleotide linked single alleles polymorphisms influence sample protein dopamine methylation slc htt signaling interaction snps genotypes status expression genotyped impact nrg phenotype psychiatric susceptibility intermediate carrying promoter maoa vulnerability wide oxtr genetics additive associations variations genome modulate number phenotypes vntr serotonergic neuronal tt sles clu haplotype independent common depression disease ace tandem epigenetic replicated variability pathway sorl psychopathology molecular studied pathways chrna dna heterozygotes htr heritable report allelic nicotinic gg carrier affects influences preliminary variable noncarriers 
95	0.01046	verbs verb nouns noun grammatical language structure generation production subject lexical morphological phrases word regular argument words syntactic object inferior linguistic number initial frontal ft sentence np irregular violations forms thematic lifg tense morphology english inflected lmtg past types sentences gender complements classes representation properties representations morphologically languages nominal stems processed theories correct lmfg inflectional phrase operations affix reanalysis options grammar dom derivational combinatorial morphosyntactic perisylvian stem substrates noncanonical complement operation tree agent lexicon underlying position gena violated transparent german transitive pl generated lipl plural auditorily spanish ungrammatical determiner claim frames embedded items neuroanatomical unaccusative phrasal inflections inflection optional grammaticality 
96	0.00643	hd psychopathy fcd mutation dystonia psychopathic disease ps huntington abnormalities violent disorder gene abnormal traits offenders onset dyt violence ks pcl symptomatic cramp incarcerated apd writer wc scores psychopaths antisocial compensatory adult mutations history characterized asymptomatic male early lrrk ld dystonic manifest focal manifesting premanifest nmc checklist prehd criminal personality revised dominant methods symp parkin homicide manifestation males symptoms signs dfmri hare scorers pink overactivity presymptomatic interpersonal radiation gba dbd mobile autosomal carrier pathophysiological fad han family paralimbic severity dtv prison fhd meige involuntary precg sporadic repeated stage nmnc hro inmates mve ethnic lifestyle subnuclei commit morbid blepharospasm approaching fulfilled 
97	0.05862	adaptation selective stimulus human cortex response representations properties sensitive types selectivity level represented representation suggest neuronal attributes visual question presented specialized selectively suggesting identity specifically modulated neurons preferentially responded coding preference code invariant populations respond independent identical manner tuning form tested independently identified showing repeated encode parts unclear position responds propose representing tuned category issue specificity nature strongly reveal paradigm represents represent set preferential abstract specialization processed environment codes modulations pairs experience preferred multiple principles separate segregated fundamental hierarchy invariance questions responding claims dimensions reliably attribute combination overlapping release fine preferences importantly property idea generally objects categorical producing separately segregation 
98	0.00905	cbf perfusion cerebral rcbf regional asl labeling born preterm els baseline resting increases vpt birth vlbw pet hypoperfusion normal positron pcasl cmro min term rest physiological values vascular ml ih injury spect pulsed measurements neuronal caffeine risk detected weeks volume technique labeled neonatal cbv rate gestational cerebrovascular global aat casl quantitative quantification weight oef metabolic cvr labelling spg nuclear quantify pseudo problems rtg minocycline sga grase prematurity hemoglobin extraction physiology metabolism measuring pasl pv quantified tc gestation infants vp water fddnp rqa marker neuroanatomy partial premature calculated consumption photon thalamic faa loe ipd mcs venous calibrated workload retardation fraction neurovascular 
99	0.01052	detection novelty oddball offers unfair norm events nss punishment deviant fairness game ultimatum violations mmn paradigm mismatch infrequent context norms rare unexpected detecting standard fair frequency deviance ug frequent familiar deviants acceptance compliance rejecting saliency salient unintentional rejection violation rejected automatic party punishing reject frequently inequity proposer reactions unfairness parties habituation standards oddballs comparator soft intentionality incongruous accept environment accepting punish normative incongruency responders enabling negativity spatially varied enforcement dictator heidelberg responder disentangling refractoriness familiarized partner infrequently underactivity considerations rates deviating rlofc prosocials societies income sensorial rejections deviancy suggesting delinquents earnings proposers juvenile unintentionally unintended society economic memoranda equiprobable unequal 
100	0.00922	gestures abstract race concrete intention gesture communicative prospective intentions speech racial communication context actor iconic stereotypes mp indirect pointing american black action videos stereotype unrelated white aa intended ig performing verbal meaningless isolated prejudice gr situation biases chinese ongoing img replies abstractness african act meaningful caucasian cultural symbolic members expressive addressee asian gestural utterances imperative concreteness means saving carry ca watched representing convey identification impact emblematic gg deceit realization deceitful pmtg accessible sg speaking polar nonlinguistic matching accompanying gsi gateways tpc intergroup retrospective blindfolded stereotypic illustrate propranolol reply emblems russian grooming comprehend european referent interpersonal highlight arbitrary nonverbal addressees overhearers 
101	0.02384	ms source sources meg time temporal localization recorded resolution spatial early onset magnetoencephalography amplitude negativity recordings latency generators dipole localized high scalp amplitudes peak response spatiotemporal head electromagnetic spatio late latencies channel separate invasive timing hemodynamic locations inverse window electrodes provide estimated simultaneous recording loreta electroencephalogram intracranial generated positivity techniques electroencephalographic modalities methods location lpp closure generation sloreta localize locked peaking peaked temporally located sam earliest realistic multimodal topography sequence magnetoencephalographic electrical post msec ssvep sessions windows dipoles range method wave epn slow precise suggested beamformer sensor waves larger generating index characteristics surface mmp synthetic generator neuromagnetic milliseconds channels categorization 
102	0.02545	method spatial methods template standard mapping maps space segmentation normalization images approach reference image proposed registration obtained map mm atlas resolution head surface techniques independent subject software spm technique procedure dataset normalized smoothing reconstructed localization mni spatially reconstruction framework conventional step projection calculated structural steps talairach location chi points advantages neurological probabilistic detection statistics foci simulated prior published invasive sulcal improve source database segmented quantitative propose validated improvement localized robustness templates artifacts positions true improved procedures package datasets preprocessing coordinate extraction ecog times initial obtain point locations institute measurement algorithms feasibility rv maxima fissure reconstruct landmarks high perform alignment boundary 
103	0.00952	timing temporal rhythm tapping pmc beat motor sequences synchrony rhythmic cerebellum finger paced sequence rhythms auditory sma regular synchronization pacing premotor interval intervals movement structure time cerebellar continuation generation main synchronized supplementary frda ja beats irregular putamen tap metric presma meter regularity number ordinal timed olive taps counting internal rhythmical isochronous metronome movements entrainment initiated vermis adjustment rate external tempo serial periodic production drumming jaw metrical durations fixed pulse hz subsecond acceleration muscular polyrhythmic syncopation precise sensorimotor timekeeping tooth synchronous aptd synchronize reproduced syncopated mediate reproduce organization index deceleration irregularity phases reproduction pace psychophysical presupplementary metrically corticostriate tapped box synchronizing 
104	0.00603	smokers smoking nicotine craving cue cues abstinence drug cigarette reactivity relapse induced withdrawal addiction nonsmokers cessation tobacco abstinent methods response cravings chronic smoke patch appetitive reported scanning messages rss mesocorticolimbic seeking neurobiological subjective neutral persuasion addicts heavy objectives reduce psas begin pack intensity relapsers quit ftnd message satiety cigarettes tailored persuasive nondrug striatum preliminary pad msv abstainers desire severity drugs male deprived nonsmoking resist prior satiated automatized thirty habitual public undergoing acetylcysteine nachr neurocircuit acute adult gwls ras cca psa quitting crave devaluation intake enrolled warning measure affirmation smoker nicotinic fagerstrom anti improvements replacement transdermal abuse occasional attempts graphic quitters 
105	0.00746	mdd depressive depression major disorder methods episode naive group sgacc severity vmhc abnormal treatment limitations anhedonia medication symptoms pathophysiology limbic trd abnormalities drug rumination onset symptom insular scale cvd hamilton method unclear tsd score antidepressant unmedicated implicated hrs illness sal comorbid underlie hcl cad rating interhemispheric therapeutic antidepressants subgenual ogm nh mirrored orbital psd svci ay pclo po unipolar mood remain elt hrsd remission homotopic abnormality nrd amic gv visceromotor screening comorbidity lower cheating otcd doxapram subcallosal treatments neurobiology abnormally rfcbt plc interpretability prognostic depressives ham neuropathology lfbf hyper symptomatology hypo imbalance wise insulae participating quin sgpfc epidemiologic ctrl habenula 
106	0.00761	blind sighted judgments judgment occipital individuals beauty visual aesthetic tactile congenitally braille early cortex experience blindness metacognitive vision paintings deprivation discrimination beautiful cb symmetry plasticity echolocation reorganization eb people landscape blindfolded congenital pva appreciation metacognition ugly nonvisual judged pictographs misjudgment touch rely deprived birth crossmodal traditional echoes jesus clicks realistic adaptations dots modal oil cataract develops retain corticocortical sight plastic immaturity oe totally supramodal lost functionality utilization referring listened luminance heard curvilinear rsmg analogs aesthetics vsts mgn blindfold photographic symmetric usual ns observers raised crossing spaces discriminating echolocating eeb egocentricity ugliness anophthalmia koniocellular cataracts tojs tempo unmatched architects geniculo ios 
107	0.0507	model models linear approach parameters method glm dcm proposed neuronal hemodynamic estimates selection optimal framework propose nonlinear hierarchical estimated inference simulated parameter fit estimation forward variables set hrf terms underlying strength parametric paper modelling simulations strengths variance structure tested standard predictions validated ac free mapping estimate resulting estimating multi noise require regressors modeled assumptions detection hidden real problem introduce precision local hypotheses variable derive simulation shape mass validity series filtering inferences generate introduced sources form theoretical analyze space sense generated utility infer variation combination implemented identifies illustrate observations search varying variations stochastic computationally analyzing properties simple improved problems layers population 
108	0.03972	visual auditory sensory modality integration modalities cortex audiovisual multisensory modal cross input presented crossmodal multimodal unimodal stimulus primary bimodal stimulation inputs congruent independent audio supramodal tactile sounds av incongruent sound vision visuo presentation interactions synchronous percept simultaneously association detection sulcus matching senses mcgurk unisensory congruency asynchronous binding perceptual audition lip superior environment simultaneous paired suppression integrated manipulated integrate streams indicating visually subject amodal heteromodal synchrony passive effectiveness fusion irrespective presence principle environmental modulate presenting integrates affect integrative spatially explored unified additive flashes lips stream mismatching inverse combinations spatiotemporal site stimulations intermodal polymodal code shapes events asynchrony profiles greatest source eyes 
109	0.0758	measures size level sample reliability large small test time subject methods voxels number method individual measure robust reliable highly higher cross series obtained tested sizes single random included retest sessions set samples addition power typical maximum voxel session reproducibility provided repeated estimates tool work tests techniques good values estimate yielded total proposed widely quantitative multi measurements variance metrics icc half larger partial range moderate distance permutation produced index reproducible selected thresholds limited estimated investigating detect testing technique evaluated limitations highest evaluate global future procedure required site calculated reliably significance sets measurement ratio needed stable priori coefficients positive conventional dataset proportion 
110	0.03229	lesions patient lesion normal impaired hemisphere intact loss deficit preserved reorganization neuropsychological focal residual group damaged mapping selective pattern unilateral compensatory syndrome severe function tests impairments structural tissue report neglect age spared symptom rare neurologically cerebral chronic surgical poor voxel surgery injury affect testing abnormal tested presence plasticity suffering tumor stroke lack disconnection isolated location large pathways involve site medical integrity spontaneous problems injured lead opportunity recovery result rbd ll suffered neurological pathology remaining capacity restricted grade dysarthria tumors severely lesioned inability persistent reorganisation profound structurally sparing localization selectively occur investigation agnosia acute amnesia congenital diffuse simple lost optic preservation 
111	0.04568	memory encoding hippocampal hippocampus retrieval subsequent successful episodic recognition formation encoded recall remembered associative items associations performance binding verbal memories success learning subsequently suggest predicted correlates phase parahippocampal prefrontal anterior forgotten tested test relational versus paired recognized declarative scanning remember association unsuccessful incidental shown material shallow mnemonic neocortical scanner benefit successfully mediated undergoing surprise face failure associates bilaterally learned memorize encode predicting materials strategies elaborative hippocampi resulting phases tests recalled episode link parahippocampus predicts improved cued transfer retrieving retrieved mtls relates subset remembering memorized consolidation retention durable served animacy reactivated volunteers profession memorization promotes forgetting episodes fit fixation composed bind 
112	0.01958	context empathy contextual contexts ambiguity ambiguous empathic dominant prosocial concern modulated resolution situations automatic unambiguous presence subordinate meanings contextually altruistic frequent social representations interpretation flexible embedded situational affects empathize scanned donation architecture disambiguating embedding settings occurs dominance oriented occurred involve suffering place share select require implicature unbalanced interdependence empathizing promotes altruism engaged implicatures donations helping empathetic balanced initially influences victim associatively scenes affect charitable ambiguities bound compatibility minimal session anb reinterpretation disambiguated care stability costly home disambiguation septal hh vicarious hospital disambiguate updated choose giving selecting importance disentangle larger hcps unempathic ifgtr humanized wanted cautious behave united important told sympathy 
113	0.01611	network global local graph ec centrality hubs state properties dc hub nodes theory structural organization modules resting eo sem topological structure values high small topology metrics path nodal theoretical lower strength modular module integration betweenness architecture world consistency communication eigenvector modularity inter segregation intrinsic organized node insights edges stable coefficients weighted globally weights clustering theoretic configurations equation explored holistic dependencies gbc locally communities coefficient distant calculated paths wise worldness transfer svd metric organizational provided connectome bn dense length ava ecm graphs definition centers mm szs gta ipfc analytic functionality characteristic absent analyze hemiparkinsonism topologies rsfmri lhc topologically kappa property unclear 
114	0.00441	vestibular tbi injury balance stimulation traumatic adaptation postural pivc insular multisensory caloric df severe prism head ao galvanic bnm vn csd ocular induced parieto otolith gvs axonal vid prismatic dai morse skull code moderate dizziness survivors irrigation hjs pwms concussive saccular nystagmus persistent free optic proprioceptive ear njs vestibulo perturbation circle semicircular sway injured reliance diffuse solidity lpt ninm bursts perturbations standing reflex disability invasive post acoustic projections precisely mvs vemps vemp myogenic sacculus clicks parietoinsular oscillopsia injuries projection tended deviation orientation afferents canals tone gage stbi neuritis prisms canal uvf adapt neuromodulation glasgow monaural pressure tongue upright cues sinusoidal 
