28	0.09894	patients schizophrenia controls healthy compared deficits reduced disorder matched symptoms increased dysfunction abnormalities decreased abnormal impaired control disease clinical age altered conclusions subjects impairments hc severity symptom psychotic alterations sz episode patient schizophrenic functional medication deficit characterized impairment illness function disorders performed aberrant pathophysiology contribute relative investigate reported evidence psychosis underwent exhibited circuits demonstrated investigated addition naive dysfunctional dysfunctions comparison functioning including suggest gender chronic syndrome compensatory abnormality unclear underlie normal sex analyzed individuals education affected hypothesis hypoactivation potential reduction treatment hyperactivation circuitry disturbances acquired scanning participated disturbed difficulties exhibit lower features twenty neuropsychological aim displayed failure feature hcs diagnosis 
29	0.01163	delay delayed roi rois discounting period delays sample future dd match term larger intentions function impulsive time ss closure included sustained analyses identified interval distracters metacognitive discount gratification persistent impulsivity spls foresight cl extend content exception psmc golfers dms intention specialized variable scd oi memoranda skilled behaviour mot hard immediately computational dmts oriented anatomical discounted indifference operators regular nonidentified vse inf handicap rostro valued mooney disruptive og vbr array hot individualized projection dnmts rld sleepiness lld fundic prefer latin spiking easier aid slow occurring ongoing delaying technique apparent probe difference stored postcategorical land devalue evc snga distending steeper rostrolateral configurations 
30	0.01058	ms patients global multiple sclerosis local cr fitness clinical areas cp contour activations lesion mp adaptive obtained relapsing atrophy disability extent remitting test pasat recruitment damage soa lower tissue ppms measures enrichment reorganization preserved cis limit occurs crt ci load rrms digit progression symbol expanded expression sdmt reserve physical progressive modalities spms serial intellectual impact rr locally mtr status ratio naa dps soas unimpaired entry days earliest score cognitively decline globally isolated metastability asynchrony contributing elements absent paced warmer gabor elders suggestive asynchronies exercises edss injury pathology testing limited stage gfi amyotrophic appearing extra mildly evolution pediatric proxies holistic temperature 
31	0.16841	activation patterns pattern compared similar response differential examined revealed contrast consistent reflect stronger individuals exhibited elicited reported lower relative suggest activated including suggests deactivation matched conditions activations type previous occurred effect extent additional demonstrated produced expected equivalent design investigate activate resulted bilaterally reflects paradigm controlled reflecting examine comparisons typical differed respect magnitude suggested block comparable implications involvement accompanied elicit robust interpreted investigation hypothesis employed highly differentially contrasts similarly scanner explore finding reverse appears larger aim indicating contrasted opposite contrasting effort displayed weaker independent sixteen strongest explained minimal analyses characterize specifically marked extensive inconsistent possibly level studied produce consequence sample unlike 
32	0.00942	verbs verb nouns processing noun grammatical language generation production thematic regular lexical morphological argument structure word words linguistic irregular class compared pl system complexity forms subject representation inflected imageability processed properties complements morphology experiment languages types object number event phrases tense wc mismatch naming examined support morphologically transitive classes picture derived nominal italian lmtg base morphosyntactic cost action comprehension implicature vgt derivational plural gena inflectional options stems aoa speakers constituent access theories implicatures unaccusative predicate embedding compound complement operation mimetic reflexives unaccusatives mbo thematically hebrew agent walk regularly singular optional overt roles grammar simple step operations revealed particles mmo onomatopoeic 
33	0.03141	language verbal hemispheric lateralization fluency asymmetry lateralized overt hallucinations dominance covert dominant laterality auditory handed handers asymmetries generation handedness tasks processing specialization speech production avh functions leftward interhemispheric word indices strongly naming sided rightward phonemic preference semantic calculated lobes nonverbal covertly difference phonological tests hallucination predominance verb callosal measured lateralisation established asymmetric vf atypical twelve involvement words index unilateral homologue determined asymmetrical expressive lateralised manual silent hemifield intra considered advantage list closely rhymes nondominant homologues typical opercularis neuropsychological conversation counterpart overtly communication provided listening output paced feature ltle assessment classical ssd flipped performing symmetrical planning cantonese formal confrontation phenomena lost 
34	0.03457	decision choice decisions risk choices uncertainty outcome risky outcomes behavioral reward behavior preferences loss probability subjective options bias participants rewards values taking losses valuation economic preference option gains individual correlated choose subjects magnitude potential distinct ambiguity reflected human regret uncertain expected relative gambling intertemporal aversion influence process safe action situations lateral monetary signals selection evaluation probabilities gain igt certainty money guide trial seeking financial subsequent strategy basis chosen utility alternatives accumulation hypothetical ambiguous term amount choosing forced probabilistic mechanisms increasing game behaviorally criterion tracked threshold gambles involving consequences health equal cost phase alternative suggest accept behaviors factors difference optimal benefits 
35	0.01473	diffusion tensor structural dti imaging anisotropy fractional integrity tracts wm ts fiber mri tractography diffusivity pathways values pathway weighted connections connecting microstructural anatomical microstructure alterations syndrome fibers cingulum correlation abnormalities lower spatial investigated structure internal underlying tic voxel statistics disruption multimodal correlated including dt probabilistic combined widespread tmt tics diameter major association af density fibre slf tbss tourette radiation myelination fascicle abnormal cst optic disconnection dwi cortico radial axon bundles interhemispheric shown suggests radiata axonal correlations lobes corona fibres adjacent adc fasciculi connect assessment combining tracking water lambda conduction axial evaluation speed index damage gts extreme abnormality relate properties coherence 
36	0.0513	visual auditory sensory modality integration blind modalities audiovisual information areas multisensory modal primary input stimulus sighted stimulation tactile subjects cortices crossmodal unimodal vision multimodal inputs signals perception bimodal congruent enhanced presentation audio interactions supramodal av sounds visuo congenitally incongruent independent sound braille human somatosensory environment blindness association hemifield dependent simultaneously experience perceptual convergence senses percept synchronous identified previously central calcarine congruency integrate basic stream presence unisensory asynchronous binding matching absence simultaneous confirmed visually integrated delivered reflects concurrent irrespective deprivation synchrony effectiveness heteromodal plasticity investigate humans additive audition nonvisual reorganization suppression source order eb flashes representations intact experiments retinotopic complementary streams 
37	0.10559	responses response imaging functional resonance magnetic individuals subjects hemodynamic suggest examined compared measured exhibited function contrast consistent cortices behavioral hypothesis pattern relative normal matched mediated demonstrated suggesting displayed degree similar studied elicited larger lower variability tested predicted potential individual suggests levels correlated reflect elevated driven initial difference heightened modulate evoke differential modulates determine maintain determined conclusions evaluated interactions pathway regional measure humans extent affect relationship hypothesized opposite responsive underwent recorded assessed visual generalized reverse measuring examining em blunted hypothesize latency exhibit coupled display earlier influenced nonlinear parameters restricted mediate marker noted variety predict life monitoring correspondence differed robust backward reports 
38	0.04271	volume gray structural voxel gm morphometry grey volumes mri thickness vbm regional density structure gmv reductions healthy age abnormalities compared controls images total anatomical resolution volumetric suggest correlated neuroanatomical matched structures cortices tissue alterations analyses loss sample morphology relationship larger revealed local weighted examined global lobes decrease reduction morphometric areas clusters morphological nss atrophy associations corrected concentration onset optimized decreased bilaterally previous gender lower surface anatomy measures included reduced sex obtained scans thinning correlations widespread uhr fep scale acquired subjects additionally assessed exhibited determine history applied scores neurological assess detected independent correction fwe comparisons reports dosage automated freesurfer gmd psychiatric 
39	0.03275	experience subjective bias individuals participants experiences perceived people cultural interoceptive status individual physical feeling perception chinese awareness sense objective judgments ratings death images evaluation viewing esteem relative american feelings culture art style racial rated pupil biases implicit psychological experienced salience pleasantness sensations social responses correlated interoception measured dilation stereotypes unknown degree examined bodily perceptions esthetic world measure person internal body scanning messages cultures negativity conscious representation subjectively reported western culturally predicted viewed correlates east trait passively experiencing exposure caucasian intense research referred mediated stereotype mcc influenced preference report alien heightened portraits videos personal reports environment asian compassion attitude moment visceral 
40	0.04061	action actions observation mirror motor gestures goal imitation tool system video execution areas movements directed neuron clips observing person simulation performed participants gesture human understanding actor body mns videos activated representations goals perception intention representation tools communicative planning aon perspective observer performing watched grasping intentions meaningless object intended viewed network iconic watching movie communication sensorimotor active movies actors view movement everyday types viewing executed depending neurons meaningful embodied agent properties stronger observe intransitive depicting act perform observers coding effector compatible postures experience plan imitated engaged strongly visuomotor pantomimes imitate players meaning preferentially skilled passively plans prediction understand passive tennis mirroring 
41	0.03068	component ica components model independent networks time spatial glm ic identified order neuronal applied parameters sources number joint free series multiple spatially simulated extracted framework courses noise single hrf driven paper algorithm hemodynamic dynamics set demonstrate propose multivariate relationships correlation identify real ics pca identifies source proposed fusion spatiotemporal temporally scale estimation identification auditory selection analyzed mass enables canonical detection statistical decomposition datasets simulation assumptions approaches describe derived wavelet features extract conventional mixture module multi called separately common technique jica artifacts freedom improve units advantage analyzing simulations constrained function intersubject existing separate coupled experiment sica identifying aspect dimensionality smri improves 
42	0.04273	role play plays key critical human suggest crucial infant behavior roles mother relationships response infants activated determined mothers separation effort including special behaviour neuroimaging relations central contribution behaviors guided aspects major remains involving mediating essential limited pifg pivotal maternal adult form unfamiliar system conditional reflective regulating supporting sites examine established behavioural playing highlighted relationship prominent facilitating examined acted dissociate suggesting viewing crying authenticity physical responsiveness fundamental nonspecific life suggests previous emergence focused implies blocking actual producing gray highlight identify generating mri contrast fathers cries predominant played involves periaqueductal authentic caregiving quantified entitled paternal baby tei element called subsequently videogame parental 
43	0.01658	noise echo imaging signal acquisition scanner epi gradient sequence time sparse neurofeedback planar ratio continuous image auditory images artifacts weighted scanning sensitivity sampling tr real mri distortion device standard bci artifact db compatible sequences snr acoustic resolution quality silent multi technique cramp slice volume conventional sbn protocol detection background writer investigation acquired volunteers rf computer contrast single pedaling frois inside protocols artefacts rapid shot volumes spin bold fluiq designs benefit slices noisy coverage coil plane applications loss recording pulse erho schemes quiet acquisitions scheme devices interference air enabled correction shrinkage interfaces readout clustered interface pressure enhance record maximum collected describe 
44	0.03741	connectivity effective causal model dynamic modeling top connections interactions network causality dcm influence models pathways modulation influences interaction bayesian driving coupling bottom strength revealed connection input structural pathway equation signals human direct forward modulatory inputs circuit modelling mediated psychophysiological modulated path information task sem enhanced computational dynamics driven selection directed neuronal interact nodes bidirectional directional characterize hierarchical form optimal indirect increasingly flow perspective inhibitory intrinsic terms loop influenced activities cortico synaptic excitatory inference reciprocal exert directly stochastic predictive collected conditional projections involving gcm feed modulate fit distributed gca ains nonlinear strengths directionality interplay putative anatomical thalamocortical gating modulations output asts 
45	0.04838	statistical mapping maps cluster parametric mri voxel anatomical spm spatial individual images standard subjects voxels surface space image normalization corrected performed size clusters segmentation template model comparisons scans obtained threshold subject comparison brains resolution difference correction software function analyzed random localization located location probabilistic applied map calculated coordinates registration probability compared anatomy cytoarchitectonic reference multiple algorithm structural extent volume average normalized type technique locations spatially variability determined thresholds proposed estimated dimensional created techniques smoothing measurements talairach regional ch distance correspondence statistically implemented boundaries sulcal rate uncorrected reconstructed estimation relevance computed error mni reconstruction localized statistics pet segmented quantitative mapped hoc 
46	0.00702	hearing deaf tinnitus sign phobia signers phobic auditory language spider sp participants signs ce phobics asl nh loss compared signed ci bsl visual native deafness ccs sps spiders cochlear controls hl nm reorganization spoken implantation blue deprivation dental languages systems extent jme sl enhanced pictures displayed characterized highly bimodal lsf speechreading american animal plasticity automatic loudness melanopsin cd phobogenic reorganized signing users effortful subtypes status exposure supporting modality rte implant pstg phobias distress experience tin altered development pure people exposed duration dp monolinguals jsl snakes british congenitally chronic retinal pseudosigns bii snake parahippocampus wg neuroplasticity injury relevant sounds injection display 
47	0.07381	information processing perceptual integration sensory stimulus visual stage process stages features itch investigated processed material integrated input type integrate conditions relevant specifically integrating content nonverbal suggested suggests aspects explicit types additional selectively encoding parallel engaged identified degraded determine occurs pathways linked evaluation biased domain feature specialization communication depending judgments ambiguous involves conveyed representations influences transfer segregation assessed scratching phases bias reflected manipulated initial absence interactive specialized requires crucial evoked kinds inputs access source differentiation extract interacts determines consistent activated gain subserving highly opposed combining combination attributes integrates identifiable advantage sought engages ei incoming formation allowed systematically evidence meaningful encode identification 
48	0.05295	age adults children development aging developmental adolescents adolescence childhood increased adult aged maturation performance adulthood reduced elderly healthy decline cognitive ages function increasing networks compared ability increases change late relative examined similar normal developing deficits compensatory compensation adolescent typically dependent life suggesting declines recruitment decreased behavioral preterm increase individuals period school exhibited range develop poor birth suggest reduction trajectories typical abilities child reductions decreases ageing recruited engagement current patterns vpt mature lifespan alterations education acquisition dd mid skills difficulties sectional evident structural trend deficient comparable specialization correlations pattern reliance neurodevelopmental iq exhibit preserved maturational average recruit functions strategies sample trajectory 
49	0.02475	conflict interference control stroop incongruent task response congruent olfactory resolution trials odor behavioral attentional color cognitive odors simon congruency word flanker effect monitoring irrelevant processing activated conflicting incompatible neutral relevant mechanisms detection conflicts situations resolve adjustments pre compatibility compatible counting event interfering version chemosensory facilitation selection pi proactive demands top resources types employed nasal odorant wmc smell overlap detecting accd competing require incompatibility situation odorless odorants air distraction resolving competition sweat olfaction proportion source scwt pc costs classic simultaneously test congruity mixtures reactive mucosa involvement sniffing modified variant threshold intranasal ignoring vanillin smelling arrow processed distractors division perfumers resolutions cdacc 
50	0.04622	learning training performance practice learned sequence implicit trained task participants motor term explicit acquisition behavioral skill transfer associations time plasticity sequences skills learn acquired stages improvement increased untrained session initial increases arbitrary learners practiced period knowledge improvements procedural days late induced scanning experience repeated pre sessions correlated improved change decreases immediately decrease increase consolidation retention examined stage exposure extensive intensive artificial week serial implicitly reduced active ability reduction adults associative visuomotor gains automatic efficiency phase facilitation interleaved adaptation order improve naive efficient highly memory proficiency success facilitated pattern expertise newly accuracy scan plastic reaction rule playing decreased dynamics enhanced scanned 
51	0.01849	sequences timing bimanual sequence coordination motor rhythm tapping sequential beat rhythmic structure synchrony movements versa vice phase paced pattern rhythms unimanual lateral musical order sequencing synchronization pacing parallel pianists symmetry predictability interval random generation context internally ordinal finger intervals musicians counting regularity demands mirror symmetric complexity structured regular piano synchronized improvisation aic continuation internal metric externally serial conditions auditory pre patterns requires precise fixed forward index active ig stability professional music beats isochronous antiphase regularities augmented unpredictability predictable reproduction rate tempo lines timed hands trains sensorimotor successive behavior modes stable asymmetrical clock organized asymmetric learned synchronous preferred metronome symmetrical tap 
52	0.01774	sleep number numerical numbers arithmetic sd magnitude calculation deprivation digit symbolic mathematical mental distance math solving rem representation multiplication addition wakefulness comparison retrieval subtraction numerosity operations night counting quantity estimation size operation single digits nonsymbolic arabic consolidation symbols solved types solution spindles competence nrem times arrays waking evening deprived exact backward tasks hips notation wake awake approximate dots quantities adults loss magnitudes dyscalculia strategies process comparisons rapid tsd forward circadian sws numerals solve participants cognition morning rested abilities eye verbal representations mathematics decade equations abstract larger compared numerosities abacus dot rely procedural represented rw spindle strategy wave recitation movement sulci 
53	0.0766	condition conditions activation control participants relative compared subjects contrast comparison lateral revealed experimental baseline suggest increased activated activations design contrasts addition required task subject single blocks included manipulation direct order minus involvement basis investigated instructed fixation bilaterally block monitoring multiple examined generation differed produced difference focused contrasted passive resulted allowed hypnotic constant series structures screen generated subtraction consisted comparing generate identical movie directly stronger separate dissociation button displayed consisting involves instructions requiring subserving time comparisons hypnosis fifteen suggestion simultaneous contained blocked factorial automatically tested scanned primarily created participant relies pair iat effective dorso subtracting masking exclusive albeit actively square simply 
54	0.01553	active passive experiment generation experiments generated meta alertness identified likelihood testing viewing mid final ale neuroimaging runs session phasic reported initial estimation intrinsic baseline rp division tasks actively mask protocol conducted clusters single candidate alerting objective published passively search hyperthermia labor produce commonly brands constrained adf ss df som elemental ideographic improve addressed define devoted generating produced replies hollow robot assisted concerned random generate candidates therapy conjunctions observing attempted producing combination dodges anb dreams oks associatively entered verify sphere therapies translation assesses attempt ipi protocols completed systematic colored hypotheses toolmaking spatiomotor regimes concurrence mofc vpl operational suppress subserved locate series 
55	0.04589	participants real life world half deception drawing correlates everyday daily research scanning knowledge instructed experiment paradigm conditions situations people responses joint investigated activities information aspects relevant revealed responded truth successful valid participant correctly questions internally series impression situation critical solutions scanner reported ecologically current answer lying online goals naturalistic types neuroimaging required production experimenter successfully question randomly detection experimental predicted externally draw communication responding manipulation explicitly detect products telling bad conditional exposed deceptive statements involves generated scenarios ability controlled investigate answers management hidden answering challenge provided dishonest incorrectly implicitly screen allowed collected subsequently experienced told test lives rostrolateral creating contributed 
